,Unnamed: 0,tweet_id,date,screen_name,location,tweet,retweet_count,favourites_count,hashtags,clean_tweet,processed_tweet,followers_count,language,verified
116,116,1291104448618663941,2020-08-05,michaelhirsh4,,Mask up Massachusetts is a new campaign to promote using a mask. Masks make a huge difference in preventing the spread of Covid19. Thanks for protecting the Piblic Health. Send a selfie wearing a mask to #MaskUpMA 👏🏻👍🙏 pic.twitter.com/0j9nQtGp3e,12,47,['MaskUpMA'],Mask up Massachusetts is a new campaign to promote using a mask. Masks make a huge difference in preventing the spread of Covid19. Thanks for protecting the Piblic Health. Send a selfie wearing a mask to,"['mask', 'massachusett', 'new', 'campaign', 'promot', 'use', 'mask', 'mask', 'make', 'huge', 'differ', 'prevent', 'spread', 'covid19', 'thank', 'protect', 'piblic', 'health', 'send', 'selfi', 'wear', 'mask']",0,en,
117,117,1291093448221745153,2020-08-05,hanigsberg,,An opportunity for compassion and empathy missed at a store for kids of all places! Consider another approach and check out tips on masking & children with disabilities … #COVID19 #Masks4All #Disney 😷 …,7,29,"['COVID19', 'Masks4All', 'Disney']",An opportunity for compassion and empathy missed at a store for kids of all places! Consider another approach and check out tips on masking & children with disabilities,"['An', 'opportun', 'compass', 'empathi', 'miss', 'store', 'kid', 'place', '!', 'consid', 'anoth', 'approach', 'check', 'tip', 'mask', '&', 'children', 'disabl']",0,en,
118,118,1290938079709138944,2020-08-05,laurahalm1011,,Coming up on 10/11 This Morning: ✔️ #LNK business in front of judge today deciding whether to close - all due to mask mandate ✔️ Questions looming over future of #Husker football season ✔️ York teacher getting creative to keep kids safe as school starts #COVID19 .@1011_News,2,3,"['LNK', 'Husker', 'COVID19']",Coming up on /11 This Morning: business in front of judge today deciding whether to close - all due to mask mandate Questions looming over future of football season York teacher getting creative to keep kids safe as school starts .,"['come', '/11', 'thi', 'morn', ':', 'busi', 'front', 'judg', 'today', 'decid', 'whether', 'close', '-', 'due', 'mask', 'mandat', 'question', 'loom', 'futur', 'footbal', 'season', 'york', 'teacher', 'get', 'creativ', 'keep', 'kid', 'safe', 'school', 'start']",0,en,
119,119,1290926649874284544,2020-08-05,greyhoodiefilms,,"Yea, you can survive #COVID19 You can also survive a bullet but that don’t mean I wanna get shot. So, yea I’m just gonna wear a mask when it’s needed.",1,4,['COVID19'],"Yea, you can survive You can also survive a bullet but that dont mean I wanna get shot. So, yea Im just gonna wear a mask when its needed.","['yea', 'surviv', 'you', 'also', 'surviv', 'bullet', 'dont', 'mean', 'wan', 'na', 'get', 'shot', 'So', 'yea', 'Im', 'gon', 'na', 'wear', 'mask', 'need']",0,en,
120,120,1295008762252496898,2020-08-16,j_shackelford,,"Today’s a great day for @GovParsonMO to issue a 4-6 week statewide mask mandate. We must do all we can to flatten the curve, lower our case numbers, and stop the spread of #COVID19 This will help our: - Schools, students, and teachers - Econony, businesses, and employees",14,41,['COVID19'],"Todays a great day for to issue a -6 week statewide mask mandate. We must do all we can to flatten the curve, lower our case numbers, and stop the spread of This will help our: - Schools, students, and teachers - Econony, businesses, and employees","['today', 'great', 'day', 'issu', '-6', 'week', 'statewid', 'mask', 'mandat', 'We', 'must', 'flatten', 'curv', 'lower', 'case', 'number', 'stop', 'spread', 'thi', 'help', ':', '-', 'school', 'student', 'teacher', '-', 'econoni', 'busi', 'employe']",0,en,
121,121,1294886672342159361,2020-08-16,javlonvakhabov,,The #Tashkent Subway is now available to the public w/ precautions against the spread of #COVID19. All passengers're required to wear masks&go through the temperature screening. In’19 @nytimes mentioned the 🇺🇿capital as “home to one of the world’s most ornate subway systems”. pic.twitter.com/RYJ4oHmX6u,9,35,"['Tashkent', 'COVID19']",The Subway is now available to the public w/ precautions against the spread of . All passengers're required to wear masks&go through the temperature screening. In19 mentioned the capital as home to one of the worlds most ornate subway systems.,"['the', 'subway', 'avail', 'public', 'w/', 'precaut', 'spread', 'all', 'passeng', ""'re"", 'requir', 'wear', 'mask', '&', 'go', 'temperatur', 'screen', 'in19', 'mention', 'capit', 'home', 'one', 'world', 'ornat', 'subway', 'system']",0,en,
122,122,1295106141379268609,2020-08-16,globalmedicdmgf,,We teamed up with @VaughanFire to distribute soap and masks and promote the three P's of COVID-19 safety. #COVID19 #StrongerTogether pic.twitter.com/30Jk5FI1VF,4,17,"['COVID19', 'StrongerTogether']",We teamed up with to distribute soap and masks and promote the three P's of COVID-19 safety.,"['We', 'team', 'distribut', 'soap', 'mask', 'promot', 'three', 'P', ""'s"", 'covid-19', 'safeti']",0,en,
123,123,1295081155629182976,2020-08-16,soulparole,,"I can appreciate @WalmartCanada having a mandatory face mask policy to keep us all safe from #Covid19 but, when you get to the till & see their ancient no-tap debit machines, it strikes me as just a bit hypocritical.",4,16,['Covid19'],"I can appreciate having a mandatory face mask policy to keep us all safe from but, when you get to the till & see their ancient no-tap debit machines, it strikes me as just a bit hypocritical.","['appreci', 'mandatori', 'face', 'mask', 'polici', 'keep', 'us', 'safe', 'get', 'till', '&', 'see', 'ancient', 'no-tap', 'debit', 'machin', 'strike', 'bit', 'hypocrit']",0,en,
124,124,1295040580146401281,2020-08-16,hanigsberg,,We are #InItTogether and #ForTheLongHaul to control the spread of #COVID19. Just ordered a new stock of reuseable masks for the family from @ROOTS with a part of the proceeds going to the @FrontLineFund supporting Canada’s hospitals including @HBKidsHospital 😷 🇨🇦👏 …,3,16,"['InItTogether', 'ForTheLongHaul', 'COVID19']",We are and to control the spread of . Just ordered a new stock of reuseable masks for the family from with a part of the proceeds going to the supporting Canadas hospitals including,"['We', 'control', 'spread', 'just', 'order', 'new', 'stock', 'reuseabl', 'mask', 'famili', 'part', 'proce', 'go', 'support', 'canada', 'hospit', 'includ']",0,en,
125,125,1294876596537634817,2020-08-16,alexeimum,,@Uber_Support @Uber__Canada @UberEats Can i ask why you disabled my #UberEats account after I made multiple reports about your drivers not wear masks? What did I do wrong? #WearADamnMask #COVID19 #Uber #SavingLives #UberEats Was asking for my safety and family safety to much? pic.twitter.com/mrVxYxKsGZ,1,0,"['UberEats', 'WearADamnMask', 'COVID19', 'Uber', 'SavingLives', 'UberEats']",Can i ask why you disabled my account after I made multiple reports about your drivers not wear masks? What did I do wrong? Was asking for my safety and family safety to much?,"['can', 'ask', 'disabl', 'account', 'made', 'multipl', 'report', 'driver', 'wear', 'mask', 'what', 'wrong', 'wa', 'ask', 'safeti', 'famili', 'safeti', 'much']",0,en,
126,126,1294874062699798528,2020-08-16,zimaluv,,"Everyone go follow my sister @Itzlotto22 she making mask 😷 #mask #support#smallbusiness #businessowner #businessnetwork #coronavirus #covid19 @ Orange, Ohio …",0,0,"['mask', 'support', 'smallbusiness', 'businessowner', 'businessnetwork', 'coronavirus', 'covid19']","Everyone go follow my sister she making mask Orange, Ohio","['everyon', 'go', 'follow', 'sister', 'make', 'mask', 'orang', 'ohio']",0,en,
127,127,1294861774118768640,2020-08-16,thecocowitch,,I got a new mask! macmkt #covid19 #mask @ Two Dogs Taphouse …,0,0,"['covid19', 'mask']",I got a new mask! macmkt Two Dogs Taphouse,"['got', 'new', 'mask', '!', 'macmkt', 'two', 'dog', 'taphous']",0,en,
128,128,1291783923975020544,2020-08-07,willisfromtheyo,,"Our inpatient #COVID19 admissions have dropped by 60% since the mask mandates were put in place, and the lowest it’s been since the beginning of June when everything opened back up. In case you still don’t think it makes a difference.",19,120,['COVID19'],"Our inpatient admissions have dropped by % since the mask mandates were put in place, and the lowest its been since the beginning of June when everything opened back up. In case you still dont think it makes a difference.","['our', 'inpati', 'admiss', 'drop', '%', 'sinc', 'mask', 'mandat', 'put', 'place', 'lowest', 'sinc', 'begin', 'june', 'everyth', 'open', 'back', 'In', 'case', 'still', 'dont', 'think', 'make', 'differ']",0,en,
129,129,1291713864959238147,2020-08-07,davidmweissman,,"You and your pundits called the virus a hoax, you kept saying it will disappear, it took you months to finally act, it took you months to finally wear a mask, you are responsible for the 160,000 lives lost to #COVID19.",153,1711,['COVID19'],"You and your pundits called the virus a hoax, you kept saying it will disappear, it took you months to finally act, it took you months to finally wear a mask, you are responsible for the lives lost to .","['you', 'pundit', 'call', 'viru', 'hoax', 'kept', 'say', 'disappear', 'took', 'month', 'final', 'act', 'took', 'month', 'final', 'wear', 'mask', 'respons', 'live', 'lost']",0,en,
130,130,1291871468796731397,2020-08-07,markpochapin,,I cannot stress enough how important it is to wear a mask. Wearing a mask protects ourselves and each other from #COVID19. It also shows #respect. I am thrilled that @ACG is supporting this important initiative. So #MaskUp ! #GITwitter …,13,36,"['COVID19', 'respect', 'MaskUp', 'GITwitter']",I cannot stress enough how important it is to wear a mask. Wearing a mask protects ourselves and each other from . It also shows . I am thrilled that is supporting this important initiative. So !,"['stress', 'enough', 'import', 'wear', 'mask', 'wear', 'mask', 'protect', 'It', 'also', 'show', 'thrill', 'support', 'import', 'initi', 'So', '!']",0,en,
131,131,1291788353122140160,2020-08-07,laradonsky,,Parents should support their children of all ages to wear #masks now. Then wearing masks in #school will not be a novelty when school reopens. #COVID19 #BacktoSchoolPlanning @tdsb,4,24,"['masks', 'school', 'COVID19', 'BacktoSchoolPlanning']",Parents should support their children of all ages to wear now. Then wearing masks in will not be a novelty when school reopens.,"['parent', 'support', 'children', 'age', 'wear', 'then', 'wear', 'mask', 'novelti', 'school', 'reopen']",0,en,
132,132,1291716988704890881,2020-08-07,operationsmile,,11-year-old Sophia raised $2000 for us by selling 200 tie-dye masks. She wanted to promote safety during the #COVID19 Pandemic while helping children born with cleft conditions just like her mom. Read more about Sophia’s inspirational story on @WTKR3 pic.twitter.com/UbE9sqHHDu,11,30,['COVID19'],-year-old Sophia raised $2000 for us by selling tie-dye masks. She wanted to promote safety during the Pandemic while helping children born with cleft conditions just like her mom. Read more about Sophias inspirational story on,"['-year-old', 'sophia', 'rais', '$', '2000', 'us', 'sell', 'tie-dy', 'mask', 'she', 'want', 'promot', 'safeti', 'pandem', 'help', 'children', 'born', 'cleft', 'condit', 'like', 'mom', 'read', 'sophia', 'inspir', 'stori']",0,en,
133,133,1291694795728060422,2020-08-07,christianne67,,"Living with face masks 😷 … How to stow them, reuse disposables & more #COVID19 😷 #MaskUp #Education 👨‍👩‍👧‍👧 #PublicHealth #PPE ☠ #DontBeACOVIDIOT pic.twitter.com/Z33YCOMm10",12,16,"['COVID19', 'MaskUp', 'Education', 'PublicHealth', 'PPE', 'DontBeACOVIDIOT']","Living with face masks How to stow them, reuse disposables & more","['live', 'face', 'mask', 'how', 'stow', 'reus', 'dispos', '&']",0,en,
134,134,1294449688293388288,2020-08-14,ashtonpittman,,"Black kids with masks, white kids without masks. I notice this a lot in Mississippi. Early on, the large majority of #COVID19 deaths in Mississippi were among Black people (~40% of the population). But those numbers have trended noticeably more white in recent months. …",12,28,['COVID19'],"Black kids with masks, white kids without masks. I notice this a lot in Mississippi. Early on, the large majority of deaths in Mississippi were among Black people (~40% of the population). But those numbers have trended noticeably more white in recent months.","['black', 'kid', 'mask', 'white', 'kid', 'without', 'mask', 'notic', 'lot', 'mississippi', 'earli', 'larg', 'major', 'death', 'mississippi', 'among', 'black', 'peopl', '~40', '%', 'popul', 'but', 'number', 'trend', 'notic', 'white', 'recent', 'month']",0,en,
135,135,1294271816345645062,2020-08-14,klinicchc,,"We need your help! We are looking for donations of new, reusable cloth masks to share with Klinic clients to help slow the spread of #Covid19. Please donate what you can to our new location at 167 Sherbrook. Your generosity is greatly appreciated! …",24,14,['Covid19'],"We need your help! We are looking for donations of new, reusable cloth masks to share with Klinic clients to help slow the spread of . Please donate what you can to our new location at Sherbrook. Your generosity is greatly appreciated!","['We', 'need', 'help', '!', 'We', 'look', 'donat', 'new', 'reusabl', 'cloth', 'mask', 'share', 'klinic', 'client', 'help', 'slow', 'spread', 'pleas', 'donat', 'new', 'locat', 'sherbrook', 'your', 'generos', 'greatli', 'appreci', '!']",0,en,
136,136,1294256736812048384,2020-08-14,hanigsberg,Holland Bloorview Kids Rehabilitation Hospital,"Have an amazing Friday & keep masking up, physical distancing and maintaining your bubbles. You are rocking this Toronto. Don’t stop now! #MaskUp #COVID19 #FridayFeeling pic.twitter.com/dk4Nrai9dC – at Holland Bloorview Kids Rehabilitation Hospital",8,49,"['MaskUp', 'COVID19', 'FridayFeeling']","Have an amazing Friday & keep masking up, physical distancing and maintaining your bubbles. You are rocking this Toronto. Dont stop now! at Holland Bloorview Kids Rehabilitation Hospital","['have', 'amaz', 'friday', '&', 'keep', 'mask', 'physic', 'distanc', 'maintain', 'bubbl', 'you', 'rock', 'toronto', 'dont', 'stop', '!', 'holland', 'bloorview', 'kid', 'rehabilit', 'hospit']",0,en,
137,137,1294157714898087937,2020-08-14,sharleesmad,,"This is frightening .people who don't wear masks,and frolic to the beach ,close to others,need to wake up covid19 wants too invade. You,infect you ,and kill you",1,6,[],"This is frightening .people who don't wear masks,and frolic to the beach ,close to others,need to wake up covid19 wants too invade. You,infect you ,and kill you","['thi', 'frighten', '.peopl', ""n't"", 'wear', 'mask', 'frolic', 'beach', 'close', 'other', 'need', 'wake', 'covid19', 'want', 'invad', 'you', 'infect', 'kill']",0,en,
138,138,1294138289000071169,2020-08-14,gregbd,,So this is what the leader of our province chooses to tweet about? Having a cold brew in provincial parks? I wonder if these are the same people do refuse to wear a mask during #covid19 ? The reason we have those laws is due to the few who are unable to control driving,0,1,['covid19'],So this is what the leader of our province chooses to tweet about? Having a cold brew in provincial parks? I wonder if these are the same people do refuse to wear a mask during ? The reason we have those laws is due to the few who are unable to control driving,"['So', 'leader', 'provinc', 'choos', 'tweet', 'have', 'cold', 'brew', 'provinci', 'park', 'wonder', 'peopl', 'refus', 'wear', 'mask', 'the', 'reason', 'law', 'due', 'unabl', 'control', 'drive']",0,en,
139,139,1293345337302638592,2020-08-11,jarmstrongbc,,"Hmmm... this grocery store has reopened its buffet. You’re supposed to wear gloves and a mask. Still, do you feel comfortable hitting up a buffet again? #COVID19 pic.twitter.com/f1EVenGdYt",10,30,['COVID19'],"Hmmm... this grocery store has reopened its buffet. Youre supposed to wear gloves and a mask. Still, do you feel comfortable hitting up a buffet again?","['hmmm', '...', 'groceri', 'store', 'reopen', 'buffet', 'your', 'suppos', 'wear', 'glove', 'mask', 'still', 'feel', 'comfort', 'hit', 'buffet']",0,en,
140,140,1293119385075417088,2020-08-11,carolinewrcb,,"#TUESDAY TOP STORIES: 🏫 Photos show no masks or social distancing in #RheaCounty schools 🚨 @HamiltonHealth say possible #COVID19 exposures at local restaurants, bars 🚓 SWAT situation in #SoddyDaisy 📁 @POTUS pulled from briefing after shooting outside white house",1,5,"['TUESDAY', 'RheaCounty', 'COVID19', 'SoddyDaisy']","TOP STORIES: Photos show no masks or social distancing in schools say possible exposures at local restaurants, bars SWAT situation in pulled from briefing after shooting outside white house","['top', 'stori', ':', 'photo', 'show', 'mask', 'social', 'distanc', 'school', 'say', 'possibl', 'exposur', 'local', 'restaur', 'bar', 'swat', 'situat', 'pull', 'brief', 'shoot', 'outsid', 'white', 'hous']",0,en,
141,141,1296259237392396288,2020-08-19,picardonhealth,,"Toronto schools will require masks😷for all students age 4 and up, by @krushowy … via @torontostar #Covid19 #Masks4All #BackToSchool🎒",165,450,"['Covid19', 'Masks4All', 'BackToSchool']","Toronto schools will require masksfor all students age and up, by via","['toronto', 'school', 'requir', 'masksfor', 'student', 'age', 'via']",0,en,
142,142,1296238018924339202,2020-08-19,bogochisaac,,"1/ 2 *possible* cases of #COVID19 acquired on a ~5 hour flight with at least 7 infected people on board (some with symptoms), and no masks worn. All in close proximity. Low transmission risk on planes - likely related to cabin air flow/air exchanges. pic.twitter.com/ksY4ikmldo",95,245,['COVID19'],"/ *possible* cases of acquired on a ~5 hour flight with at least infected people on board (some with symptoms), and no masks worn. All in close proximity. Low transmission risk on planes - likely related to cabin air flow/air exchanges.","['/', '*', 'possibl', '*', 'case', 'acquir', '~5', 'hour', 'flight', 'least', 'infect', 'peopl', 'board', 'symptom', 'mask', 'worn', 'all', 'close', 'proxim', 'low', 'transmiss', 'risk', 'plane', '-', 'like', 'relat', 'cabin', 'air', 'flow/air', 'exchang']",0,en,
143,143,1296191629968187395,2020-08-19,cdcgov,,"Although the number of #COVID19 cases in most states continued to decline over the last 7 days, the rate of decline is slowing. COVID-19 is widespread in many areas & 6 states reported over 10k new cases. Wear a mask, stay 6 ft from others & wash your hands. pic.twitter.com/QIbgGgcZ2X",348,534,['COVID19'],"Although the number of cases in most states continued to decline over the last days, the rate of decline is slowing. COVID-19 is widespread in many areas & states reported over k new cases. Wear a mask, stay ft from others & wash your hands.","['although', 'number', 'case', 'state', 'continu', 'declin', 'last', 'day', 'rate', 'declin', 'slow', 'covid-19', 'widespread', 'mani', 'area', '&', 'state', 'report', 'k', 'new', 'case', 'wear', 'mask', 'stay', 'ft', 'other', '&', 'wash', 'hand']",0,en,
144,144,1296171085902356480,2020-08-19,newsmaciver,,.@DHSWI admits it does not have a specific goal for what it wants to accomplish with the statewide mask mandate. #WIright #COVID19 pic.twitter.com/eKUq7O59lG,8,11,"['WIright', 'COVID19']",. admits it does not have a specific goal for what it wants to accomplish with the statewide mask mandate.,"['admit', 'specif', 'goal', 'want', 'accomplish', 'statewid', 'mask', 'mandat']",0,en,
145,145,1296155840542584833,2020-08-19,governorva,,"If we want to protect our families and communities, keep our economy open, safely send our kids back to school, and put this health crisis behind us, everyone needs to wear a mask. We can beat #COVID19 if we all do our part. pic.twitter.com/wsza0s1DCg",140,648,['COVID19'],"If we want to protect our families and communities, keep our economy open, safely send our kids back to school, and put this health crisis behind us, everyone needs to wear a mask. We can beat if we all do our part.","['If', 'want', 'protect', 'famili', 'commun', 'keep', 'economi', 'open', 'safe', 'send', 'kid', 'back', 'school', 'put', 'health', 'crisi', 'behind', 'us', 'everyon', 'need', 'wear', 'mask', 'We', 'beat', 'part']",0,en,
146,146,1296133133553860613,2020-08-19,bkives,,"Manitoba will make masks mandatory in schools from Grades 4-12 where distancing is not possible, premier says. #cbcmb #covid19",99,415,"['cbcmb', 'covid19']","Manitoba will make masks mandatory in schools from Grades -12 where distancing is not possible, premier says.","['manitoba', 'make', 'mask', 'mandatori', 'school', 'grade', '-12', 'distanc', 'possibl', 'premier', 'say']",0,en,
147,147,1296111053512876033,2020-08-19,onresources,,"Ontario’s forest industry is playing an important role during the COVID-19 outbreak. They’re providing materials used in hospital masks, gowns and other hygiene products, packaging for sterile medical and food wrappings, and boxes and containers for transporting goods. #COVID19 pic.twitter.com/OLl39sM4Mz",9,15,['COVID19'],"Ontarios forest industry is playing an important role during the COVID-19 outbreak. Theyre providing materials used in hospital masks, gowns and other hygiene products, packaging for sterile medical and food wrappings, and boxes and containers for transporting goods.","['ontario', 'forest', 'industri', 'play', 'import', 'role', 'covid-19', 'outbreak', 'theyr', 'provid', 'materi', 'use', 'hospit', 'mask', 'gown', 'hygien', 'product', 'packag', 'steril', 'medic', 'food', 'wrap', 'box', 'contain', 'transport', 'good']",0,en,
148,148,1296110967563202564,2020-08-19,ahahospitals,,"From grocery stores to the office, you should #WearAMask when in public or in areas where it’s difficult to maintain social distance. Protect yourself and others against #COVID19 and wear your mask. pic.twitter.com/iLW9w6dATv",90,224,"['WearAMask', 'COVID19']","From grocery stores to the office, you should when in public or in areas where its difficult to maintain social distance. Protect yourself and others against and wear your mask.","['from', 'groceri', 'store', 'offic', 'public', 'area', 'difficult', 'maintain', 'social', 'distanc', 'protect', 'other', 'wear', 'mask']",0,en,
149,149,1296198739032338432,2020-08-19,mohawksup,,A couple more days till the start of the school year. Check here for any changes in your school's schedule due to a COVID19 outbreak in a building or the district. The keys to having more in-person school are: Stay home if ill Wear your mask Wash your hands Physically distance pic.twitter.com/2Rp7QSYK20,2,9,[],A couple more days till the start of the school year. Check here for any changes in your school's schedule due to a COVID19 outbreak in a building or the district. The keys to having more in-person school are: Stay home if ill Wear your mask Wash your hands Physically distance,"['A', 'coupl', 'day', 'till', 'start', 'school', 'year', 'check', 'chang', 'school', ""'s"", 'schedul', 'due', 'covid19', 'outbreak', 'build', 'district', 'the', 'key', 'in-person', 'school', ':', 'stay', 'home', 'ill', 'wear', 'mask', 'wash', 'hand', 'physic', 'distanc']",0,en,
150,150,1296071428358447105,2020-08-19,cdctravel,,"If you travel, take steps to protect yourself & others from #COVID19: • Wear a mask in public. • Avoid close contact with others. Stay at least 6 feet from anyone not from your household. • Wash your hands often or use hand sanitizer. pic.twitter.com/OAaeKoAifh",79,123,['COVID19'],"If you travel, take steps to protect yourself & others from : Wear a mask in public. Avoid close contact with others. Stay at least feet from anyone not from your household. Wash your hands often or use hand sanitizer.","['If', 'travel', 'take', 'step', 'protect', '&', 'other', ':', 'wear', 'mask', 'public', 'avoid', 'close', 'contact', 'other', 'stay', 'least', 'feet', 'anyon', 'household', 'wash', 'hand', 'often', 'use', 'hand', 'sanit']",0,en,
151,151,1295998495808204800,2020-08-19,hselive,,Disposable face masks are used by many of us to help protect our communities from #COVID19. Always put your used face mask into a waste bin when you are finished using it. Never discard in public places. Find more information on face coverings here: pic.twitter.com/G2TbzjQI4n,29,48,['COVID19'],Disposable face masks are used by many of us to help protect our communities from . Always put your used face mask into a waste bin when you are finished using it. Never discard in public places. Find more information on face coverings here:,"['dispos', 'face', 'mask', 'use', 'mani', 'us', 'help', 'protect', 'commun', 'alway', 'put', 'use', 'face', 'mask', 'wast', 'bin', 'finish', 'use', 'never', 'discard', 'public', 'place', 'find', 'inform', 'face', 'cover', ':']",0,en,
152,152,1296061389614788608,2020-08-19,sexcsenorita,,I feel like I am a part time masked crusader #COVID19,0,0,['COVID19'],I feel like I am a part time masked crusader,"['feel', 'like', 'part', 'time', 'mask', 'crusad']",0,en,
