,Unnamed: 0,tweet_id,date,screen_name,location,tweet,retweet_count,favourites_count,hashtags,clean_tweet,processed_tweet,followers_count,language,verified
77,77,1296644298285383680,2020-08-20,inspiringu2,,"Don't text while driving. Use your seatbelt. And, ALWAYS wear your mask! #COVID19 pic.twitter.com/6y7LgEWjQF",24,83,['COVID19'],"Don't text while driving. Use your seatbelt. And, ALWAYS wear your mask!","['Do', ""n't"", 'text', 'drive', 'use', 'seatbelt', 'and', 'alway', 'wear', 'mask', '!']",0,en,
78,78,1296536253517762564,2020-08-20,cdcemergency,,Does wearing a mask mean you don’t have to practice social distancing? The answer is no. Wearing a mask while in public AND maintaining 6 feet of distance from other people are two actions to help stop the spread of #COVID19. Learn more: pic.twitter.com/VHyf9lRO9s,352,516,['COVID19'],Does wearing a mask mean you dont have to practice social distancing? The answer is no. Wearing a mask while in public AND maintaining feet of distance from other people are two actions to help stop the spread of . Learn more:,"['doe', 'wear', 'mask', 'mean', 'dont', 'practic', 'social', 'distanc', 'the', 'answer', 'wear', 'mask', 'public', 'and', 'maintain', 'feet', 'distanc', 'peopl', 'two', 'action', 'help', 'stop', 'spread', 'learn', ':']",0,en,
79,79,1296446892117721088,2020-08-20,governortomwolf,,"People who survive #COVID19 can experience serious long-term complications. Please take COVID seriously: Wash your hands, keep your physical distance from others, wear masks out in public, and stay home if you are sick. …",117,394,['COVID19'],"People who survive can experience serious long-term complications. Please take COVID seriously: Wash your hands, keep your physical distance from others, wear masks out in public, and stay home if you are sick.","['peopl', 'surviv', 'experi', 'seriou', 'long-term', 'complic', 'pleas', 'take', 'covid', 'serious', ':', 'wash', 'hand', 'keep', 'physic', 'distanc', 'other', 'wear', 'mask', 'public', 'stay', 'home', 'sick']",0,en,
80,80,1296593065570861066,2020-08-20,soloyochapin,,It's sad and scary to see so many #MAGA cult members not wearing a mask as they salute their cult leader @realDonaldTrump who is basically letting them all die of #COVID19 #VoteBlueToSaveAmerica #TrumpLiesAmericansDie … pic.twitter.com/M6ryqaFoia,72,573,"['MAGA', 'COVID19', 'VoteBlueToSaveAmerica', 'TrumpLiesAmericansDie']",It's sad and scary to see so many cult members not wearing a mask as they salute their cult leader who is basically letting them all die of,"['It', ""'s"", 'sad', 'scari', 'see', 'mani', 'cult', 'member', 'wear', 'mask', 'salut', 'cult', 'leader', 'basic', 'let', 'die']",0,en,
81,81,1296491718544695300,2020-08-20,fdafood,,The best way to prevent #COVID19 is to avoid being exposed to it. Wash your hands often with soap & water; cover your mouth & nose with a non-surgical mask when around others; avoid crowds & practice social distancing. More tips:,10,9,['COVID19'],The best way to prevent is to avoid being exposed to it. Wash your hands often with soap & water; cover your mouth & nose with a non-surgical mask when around others; avoid crowds & practice social distancing. More tips:,"['the', 'best', 'way', 'prevent', 'avoid', 'expos', 'wash', 'hand', 'often', 'soap', '&', 'water', 'cover', 'mouth', '&', 'nose', 'non-surg', 'mask', 'around', 'other', 'avoid', 'crowd', '&', 'practic', 'social', 'distanc', 'more', 'tip', ':']",0,en,
82,82,1296460771044491264,2020-08-20,cdcemergency,,#WearAMask that covers your nose and mouth to help protect others and slow the spread of #COVID19. Learn how to wear your mask correctly: #DoYourPart pic.twitter.com/KRuZvN1NRO,220,222,"['WearAMask', 'COVID19', 'DoYourPart']",that covers your nose and mouth to help protect others and slow the spread of . Learn how to wear your mask correctly:,"['cover', 'nose', 'mouth', 'help', 'protect', 'other', 'slow', 'spread', 'learn', 'wear', 'mask', 'correctli', ':']",0,en,
83,83,1296447001459122177,2020-08-20,wearingiscaring,,"Are face shields effective? Compared to masks, face shields add the benefit of eye protection, but they fail to block smaller aerosols. Therefore, face shields can be worn with masks but they CANNOT replace masks. Learn more at … #COVID19 #WearAMask pic.twitter.com/tQ3XI0N0Qf",108,171,"['COVID19', 'WearAMask']","Are face shields effective? Compared to masks, face shields add the benefit of eye protection, but they fail to block smaller aerosols. Therefore, face shields can be worn with masks but they CANNOT replace masks. Learn more at","['are', 'face', 'shield', 'effect', 'compar', 'mask', 'face', 'shield', 'add', 'benefit', 'eye', 'protect', 'fail', 'block', 'smaller', 'aerosol', 'therefor', 'face', 'shield', 'worn', 'mask', 'can', 'not', 'replac', 'mask', 'learn']",0,en,
84,84,1296416701077049344,2020-08-20,pennsylvaniagov,,"Want to get crafty, stay fashionable, and help stop the spread of #COVID19? Make your own cloth mask! Here’s how ⤵️ #MaskUpPA pic.twitter.com/aDKVn0HiBE",11,37,"['COVID19', 'MaskUpPA']","Want to get crafty, stay fashionable, and help stop the spread of ? Make your own cloth mask! Heres how","['want', 'get', 'crafti', 'stay', 'fashion', 'help', 'stop', 'spread', 'make', 'cloth', 'mask', '!', 'here']",0,en,
85,85,1296334314838175744,2020-08-20,deko_gurl,,Finally wore my new @simplyseattle mask tonight & the Mariners won! #simplyseattle #mask #gomariners #pnw #covid19 pic.twitter.com/RUlluMw4vR,0,1,"['simplyseattle', 'mask', 'gomariners', 'pnw', 'covid19']",Finally wore my new mask tonight & the Mariners won!,"['final', 'wore', 'new', 'mask', 'tonight', '&', 'marin', '!']",0,en,
86,86,1296311906362417152,2020-08-20,highchimp,,People of Planet Earth who opt to wear face masks over your chin rather than mouth & nose: Do you also wear condoms over your balls rather than penis? #coronavirus #COVID19,0,0,"['coronavirus', 'COVID19']",People of Planet Earth who opt to wear face masks over your chin rather than mouth & nose: Do you also wear condoms over your balls rather than penis?,"['peopl', 'planet', 'earth', 'opt', 'wear', 'face', 'mask', 'chin', 'rather', 'mouth', '&', 'nose', ':', 'Do', 'also', 'wear', 'condom', 'ball', 'rather', 'peni']",0,en,
87,87,1295788611879788544,2020-08-18,multcohealth,,Wearing a mask says everything. #COVID19 #WearAMask pic.twitter.com/1SGW0IcKXU,7,12,"['COVID19', 'WearAMask']",Wearing a mask says everything.,"['wear', 'mask', 'say', 'everyth']",0,en,
88,88,1295783402289995779,2020-08-18,conversationca,,Parents and teachers: What questions do you have about kids and masks at school? We’ll answer frequently asked questions in an upcoming article. #CoronavirusTC #COVID19 pic.twitter.com/wb2dA5Ans2,7,7,"['CoronavirusTC', 'COVID19']",Parents and teachers: What questions do you have about kids and masks at school? Well answer frequently asked questions in an upcoming article.,"['parent', 'teacher', ':', 'what', 'question', 'kid', 'mask', 'school', 'well', 'answer', 'frequent', 'ask', 'question', 'upcom', 'articl']",0,en,
89,89,1295897594053500928,2020-08-18,pushyourself2bg,,🚨🚨NEW VIDEO ALERT 🚨🚨 im wondering if mask and social distancing will be our new norm?! Lets do our part and keep implementing! #SocialDistancing #pandemic #COVID19 pic.twitter.com/WZU4byYjJi,0,0,"['SocialDistancing', 'pandemic', 'COVID19']",NEW VIDEO ALERT im wondering if mask and social distancing will be our new norm?! Lets do our part and keep implementing!,"['new', 'video', 'alert', 'im', 'wonder', 'mask', 'social', 'distanc', 'new', 'norm', '!', 'let', 'part', 'keep', 'implement', '!']",0,en,
90,90,1295734248977170440,2020-08-18,hhsgov,,"As we all continue to prevent the spread of #COVID19, protect your community by wearing a mask if you need to be in public. Learn more from the @CDCgov: . pic.twitter.com/c0HJfV04nd",182,286,['COVID19'],"As we all continue to prevent the spread of , protect your community by wearing a mask if you need to be in public. Learn more from the : .","['As', 'continu', 'prevent', 'spread', 'protect', 'commun', 'wear', 'mask', 'need', 'public', 'learn', ':']",0,en,
91,91,1295703988713787392,2020-08-18,kcbankruptcy,,"As of today 1,454 Missourians will never experience another sunrise because they lost their life to #COVID19 during @GovParsonMO watch. Wear a mask @GovParsonMO and save lives.",7,18,['COVID19'],As of today Missourians will never experience another sunrise because they lost their life to during watch. Wear a mask and save lives.,"['As', 'today', 'missourian', 'never', 'experi', 'anoth', 'sunris', 'lost', 'life', 'watch', 'wear', 'mask', 'save', 'live']",0,en,
92,92,1295691919973023744,2020-08-18,governortomwolf,,"About 1 in 4 #COVID19 deaths can be prevented from now through December 1 if more of us wear masks, according to @UW’s Institute for Health Metrics and Evaluation. …",126,551,['COVID19'],"About in deaths can be prevented from now through December if more of us wear masks, according to Institute for Health Metrics and Evaluation.","['about', 'death', 'prevent', 'decemb', 'us', 'wear', 'mask', 'accord', 'institut', 'health', 'metric', 'evalu']",0,en,
93,93,1295670249212325888,2020-08-18,bentnews,,"Downward #COVID19 trends in NC! Why? Experts say the 6/26 mask mandate. The CDC recommended masks in early April. That means we spent 3 months begging skeptics to wear them. Months. People got sick. People died. A reminder: trust the scientists, not your crazy uncle. #WakeUpCLT pic.twitter.com/l6j1Gx0eHL",111,499,"['COVID19', 'WakeUpCLT']","Downward trends in NC! Why? Experts say the /26 mask mandate. The CDC recommended masks in early April. That means we spent months begging skeptics to wear them. Months. People got sick. People died. A reminder: trust the scientists, not your crazy uncle.","['downward', 'trend', 'NC', '!', 'whi', 'expert', 'say', '/26', 'mask', 'mandat', 'the', 'cdc', 'recommend', 'mask', 'earli', 'april', 'that', 'mean', 'spent', 'month', 'beg', 'skeptic', 'wear', 'month', 'peopl', 'got', 'sick', 'peopl', 'die', 'A', 'remind', ':', 'trust', 'scientist', 'crazi', 'uncl']",0,en,
94,94,1295668027959189505,2020-08-18,chantale_perron,,"My very first coffee outside since #COVID19 and i can't say that I'll repeat. Poor ambience. I can't get used to see masks, no matter what i do. It's just a sad and depressing vision of society. But, i tried it. Now back to home coffee. Their decaf sucks anyways. Mine doesn't. pic.twitter.com/TMlvASXDnU",0,0,['COVID19'],"My very first coffee outside since and i can't say that I'll repeat. Poor ambience. I can't get used to see masks, no matter what i do. It's just a sad and depressing vision of society. But, i tried it. Now back to home coffee. Their decaf sucks anyways. Mine doesn't.","['My', 'first', 'coffe', 'outsid', 'sinc', 'ca', ""n't"", 'say', ""'ll"", 'repeat', 'poor', 'ambienc', 'ca', ""n't"", 'get', 'use', 'see', 'mask', 'matter', 'It', ""'s"", 'sad', 'depress', 'vision', 'societi', 'but', 'tri', 'now', 'back', 'home', 'coffe', 'their', 'decaf', 'suck', 'anyway', 'mine', ""n't""]",0,en,
95,95,1295646812406153216,2020-08-18,macaulj2,,"Wish people wouldn't do this. Really harmful for the environment . Not sure which is worse, people's constant littering with their masks or Covid19. #climateemergency pic.twitter.com/5EFYtJUxgN",0,0,['climateemergency'],"Wish people wouldn't do this. Really harmful for the environment . Not sure which is worse, people's constant littering with their masks or Covid19.","['wish', 'peopl', 'would', ""n't"", 'realli', 'harm', 'environ', 'not', 'sure', 'wors', 'peopl', ""'s"", 'constant', 'litter', 'mask', 'covid19']",0,en,
96,96,1295642652369719296,2020-08-18,wendy_runion,,This idiot you call a “president” has created the Trump virus. Only the smart people wear masks! Then you have people who are covid19 positive that can’t attend their loved ones funerals “that died from covid19”but you want them to stand in a line to vote?? #BidenHarris2020,0,0,['BidenHarris2020'],This idiot you call a president has created the Trump virus. Only the smart people wear masks! Then you have people who are covid19 positive that cant attend their loved ones funerals that died from covid19but you want them to stand in a line to vote??,"['thi', 'idiot', 'call', 'presid', 'creat', 'trump', 'viru', 'onli', 'smart', 'peopl', 'wear', 'mask', '!', 'then', 'peopl', 'covid19', 'posit', 'cant', 'attend', 'love', 'one', 'funer', 'die', 'covid19but', 'want', 'stand', 'line', 'vote']",0,en,
97,97,1295619736982749184,2020-08-18,savewildbees,,Some parents are saying there will be impacts on oxygen levels for kids wearing masks all day. As far as I know there's nothing to support that and you know what does impact your oxygen levels?? #COVID19 and the scarred lungs some people have to live with after recovery.,4,50,['COVID19'],Some parents are saying there will be impacts on oxygen levels for kids wearing masks all day. As far as I know there's nothing to support that and you know what does impact your oxygen levels?? and the scarred lungs some people have to live with after recovery.,"['some', 'parent', 'say', 'impact', 'oxygen', 'level', 'kid', 'wear', 'mask', 'day', 'As', 'far', 'know', ""'s"", 'noth', 'support', 'know', 'impact', 'oxygen', 'level', 'scar', 'lung', 'peopl', 'live', 'recoveri']",0,en,
98,98,1295612419276812288,2020-08-18,mshaynerush,,"Hey XGen, what's the R0, spoken are-naught, value for the flu? Ebola? Measles? What about the covid19? Do you know what that is? Flu. Pretty well known. COVID19. Deadlier but we don't know much about it. If masks are ineffective, why are health professionals using them?",0,0,[],"Hey XGen, what's the R0, spoken are-naught, value for the flu? Ebola? Measles? What about the covid19? Do you know what that is? Flu. Pretty well known. COVID19. Deadlier but we don't know much about it. If masks are ineffective, why are health professionals using them?","['hey', 'xgen', ""'s"", 'R0', 'spoken', 'are-naught', 'valu', 'flu', 'ebola', 'measl', 'what', 'covid19', 'Do', 'know', 'flu', 'pretti', 'well', 'known', 'covid19', 'deadlier', ""n't"", 'know', 'much', 'If', 'mask', 'ineffect', 'health', 'profession', 'use']",0,en,
99,99,1295601332322103296,2020-08-18,rizalvi98,,"No matter how you tell this people that mask helps and Covid19 is real, these people are hard headed not until they get the virus and will be fighting for@their lives, maybe they will realize this",0,0,[],"No matter how you tell this people that mask helps and Covid19 is real, these people are hard headed not until they get the virus and will be fighting for lives, maybe they will realize this","['No', 'matter', 'tell', 'peopl', 'mask', 'help', 'covid19', 'real', 'peopl', 'hard', 'head', 'get', 'viru', 'fight', 'live', 'mayb', 'realiz']",0,en,
100,100,1295592459469312003,2020-08-18,next_betty,,I want to make one thing very clear.....wearing a mask when it is 'mandated' does not equate to believing that it works to prevent the spread of Covid19. Many of us are only wearing masks to keep from being fined or to keep our jobs. Never assume otherwise.,0,0,[],I want to make one thing very clear.....wearing a mask when it is 'mandated' does not equate to believing that it works to prevent the spread of Covid19. Many of us are only wearing masks to keep from being fined or to keep our jobs. Never assume otherwise.,"['want', 'make', 'one', 'thing', 'clear', '.....', 'wear', 'mask', ""'mandat"", 'equat', 'believ', 'work', 'prevent', 'spread', 'covid19', 'mani', 'us', 'wear', 'mask', 'keep', 'fine', 'keep', 'job', 'never', 'assum', 'otherwis']",0,en,
101,101,1295591974154784768,2020-08-18,smashlock13,,"Not in Canada. COVID19 second wave could be worse than the first according to Dr WHO (Tam). Apparently, even with masks and suppression of fundamental freedoms COVID19 is more dangerous the second time around",9,41,[],"Not in Canada. COVID19 second wave could be worse than the first according to Dr WHO (Tam). Apparently, even with masks and suppression of fundamental freedoms COVID19 is more dangerous the second time around","['not', 'canada', 'covid19', 'second', 'wave', 'could', 'wors', 'first', 'accord', 'Dr', 'who', 'tam', 'appar', 'even', 'mask', 'suppress', 'fundament', 'freedom', 'covid19', 'danger', 'second', 'time', 'around']",0,en,
102,102,1295588639187951616,2020-08-18,zen4ever2us,,"Mississippi Quarantines 2,035 Students & Teachers as 444 Test Positive for #COVID19. Gov. Tate Reeves attended a press conference with his unmistakable red MAGA mask. While attempting to explaining the infectious spread. He is failing. Badly. …",5,11,['COVID19'],Mississippi Quarantines Students & Teachers as Test Positive for . Gov. Tate Reeves attended a press conference with his unmistakable red MAGA mask. While attempting to explaining the infectious spread. He is failing. Badly.,"['mississippi', 'quarantin', 'student', '&', 'teacher', 'test', 'posit', 'gov', 'tate', 'reev', 'attend', 'press', 'confer', 'unmistak', 'red', 'maga', 'mask', 'while', 'attempt', 'explain', 'infecti', 'spread', 'He', 'fail', 'badli']",0,en,
103,103,1295586222341910528,2020-08-18,conversationedu,,"Despite #COVID19 reemerging in Auckland, public mask wearing is still relatively rare for New Zealanders. Elspeth Tilley @MasseyUni discusses how ethics could guide their everyday decision making: …",1,5,['COVID19'],"Despite reemerging in Auckland, public mask wearing is still relatively rare for New Zealanders. Elspeth Tilley discusses how ethics could guide their everyday decision making:","['despit', 'reemerg', 'auckland', 'public', 'mask', 'wear', 'still', 'rel', 'rare', 'new', 'zealand', 'elspeth', 'tilley', 'discuss', 'ethic', 'could', 'guid', 'everyday', 'decis', 'make', ':']",0,en,
104,104,1290072291368267777,2020-08-02,david_leavitt,,Testing doesn’t cause cases. Idiotically attending group gatherings and not wearing masks causes new cases. #COVID19 #COVIDIOTS #coronavirus,119,576,"['COVID19', 'COVIDIOTS', 'coronavirus']",Testing doesnt cause cases. Idiotically attending group gatherings and not wearing masks causes new cases.,"['test', 'doesnt', 'caus', 'case', 'idiot', 'attend', 'group', 'gather', 'wear', 'mask', 'caus', 'new', 'case']",0,en,
105,105,1289897981177520129,2020-08-02,jerameyanderson,,"Gov. @tatereeves—good morning, it’s Sunday, August 2, 2020 we’re about 6 months into the pandemic. We’ve loss over 1,500 Mississippians and over 60,000 have been infected with #Covid19. What is enough? Issue the statewide order mandating masks. This is Day 28 of my request? #Lead",25,76,"['Covid19', 'Lead']","Gov. morning, its Sunday, August , were about months into the pandemic. Weve loss over Mississippians and over have been infected with . What is enough? Issue the statewide order mandating masks. This is Day of my request?","['gov', 'morn', 'sunday', 'august', 'month', 'pandem', 'weve', 'loss', 'mississippian', 'infect', 'what', 'enough', 'issu', 'statewid', 'order', 'mandat', 'mask', 'thi', 'day', 'request']",0,en,
106,106,1289810343837855744,2020-08-02,jerimiller110,,"Their rights? What about the rights of other people to stay safe from COVID19? These guys maybe could have set up by appt visits, made masks used, only a few patrons at a time, using safe distancing, wiping down equipment thoroughly between users. 🙄 …",0,0,[],"Their rights? What about the rights of other people to stay safe from COVID19? These guys maybe could have set up by appt visits, made masks used, only a few patrons at a time, using safe distancing, wiping down equipment thoroughly between users.","['their', 'right', 'what', 'right', 'peopl', 'stay', 'safe', 'covid19', 'these', 'guy', 'mayb', 'could', 'set', 'appt', 'visit', 'made', 'mask', 'use', 'patron', 'time', 'use', 'safe', 'distanc', 'wipe', 'equip', 'thoroughli', 'user']",0,en,
107,107,1289792050800390145,2020-08-02,budman99wi,,"Over 148,000 Americans 🇺🇸 have died. We are not showing them any respect or learning from the senseless deaths that could be avoided by wearing a mask. Obviously Washington County and other counties are failing as #COVID19 # 's keep⬆⬆ #WearADamnMask",0,0,"['COVID19', 'WearADamnMask']",Over Americans have died. We are not showing them any respect or learning from the senseless deaths that could be avoided by wearing a mask. Obviously Washington County and other counties are failing as 's keep,"['over', 'american', 'die', 'We', 'show', 'respect', 'learn', 'senseless', 'death', 'could', 'avoid', 'wear', 'mask', 'obvious', 'washington', 'counti', 'counti', 'fail', ""'s"", 'keep']",0,en,
108,108,1294625527534432258,2020-08-15,rebeccayu,,"Why wear masks? #Humility, #Kindness #Community @MarchForScience @jkwan_md @KashPrime @Samir_Grover @AngelaMCheung @masks4canada @MaskupCanada #COVID19 #MasksSaveLives pic.twitter.com/qOIMDXhiqz",41,76,"['Humility', 'Kindness', 'Community', 'COVID19', 'MasksSaveLives']","Why wear masks? ,","['whi', 'wear', 'mask']",0,en,
109,109,1294845682734563328,2020-08-15,ncleanne,,So upset. Just learned that 2 friends I love a lot are sick with #COVID19 🙏 Wear a damn mask and act like you care about someone besides yourself! I’m done being nice about it.,3,19,['COVID19'],So upset. Just learned that friends I love a lot are sick with Wear a damn mask and act like you care about someone besides yourself! Im done being nice about it.,"['So', 'upset', 'just', 'learn', 'friend', 'love', 'lot', 'sick', 'wear', 'damn', 'mask', 'act', 'like', 'care', 'someon', 'besid', '!', 'Im', 'done', 'nice']",0,en,
110,110,1290798552910684162,2020-08-04,waltermasterson,,This Doctor doesn’t believe in masks. The liberal media doesn’t want you to know about him! Share this with a Patriot!🇺🇸🇺🇸🇺🇸❤️❤️❤️#covid19 #5G pic.twitter.com/GsCUDraYK4,55,227,"['covid19', '5G']",This Doctor doesnt believe in masks. The liberal media doesnt want you to know about him! Share this with a Patriot!,"['thi', 'doctor', 'doesnt', 'believ', 'mask', 'the', 'liber', 'media', 'doesnt', 'want', 'know', '!', 'share', 'patriot', '!']",0,en,
111,111,1290773969935765505,2020-08-04,cherokeenation,,"#CherokeeNation citizen Frankie Hargis, the CN Registrar and a #COVID19 survivor, shares her experience with the virus, why wearing a mask is important, and the reality of what can happen if safety precautions are not taken seriously. Watch here: … pic.twitter.com/EPAnZTfBro",15,48,"['CherokeeNation', 'COVID19']","citizen Frankie Hargis, the CN Registrar and a survivor, shares her experience with the virus, why wearing a mask is important, and the reality of what can happen if safety precautions are not taken seriously. Watch here:","['citizen', 'franki', 'hargi', 'CN', 'registrar', 'survivor', 'share', 'experi', 'viru', 'wear', 'mask', 'import', 'realiti', 'happen', 'safeti', 'precaut', 'taken', 'serious', 'watch', ':']",0,en,
112,112,1290724739787436035,2020-08-04,calabro13sports,,I had a ‘brave guy’ on Facebook call me a “sheep” for wearing a face mask. Thanks for making feel like I was back on the Westlake Elementary school playground. Please don’t take my lunchbox bully!! Lol. #COVID19,18,907,['COVID19'],I had a brave guy on Facebook call me a sheep for wearing a face mask. Thanks for making feel like I was back on the Westlake Elementary school playground. Please dont take my lunchbox bully!! Lol.,"['brave', 'guy', 'facebook', 'call', 'sheep', 'wear', 'face', 'mask', 'thank', 'make', 'feel', 'like', 'back', 'westlak', 'elementari', 'school', 'playground', 'pleas', 'dont', 'take', 'lunchbox', 'bulli', '!', '!', 'lol']",0,en,
113,113,1290630955816882177,2020-08-04,jerameyanderson,,"Gov. @tatereeves, today in your Executive Order you should include a statewide mask mandate. A proactive common sense approach is how we better mitigate #COVID19.",21,95,['COVID19'],"Gov. , today in your Executive Order you should include a statewide mask mandate. A proactive common sense approach is how we better mitigate .","['gov', 'today', 'execut', 'order', 'includ', 'statewid', 'mask', 'mandat', 'A', 'proactiv', 'common', 'sens', 'approach', 'better', 'mitig']",0,en,
114,114,1290674423763214337,2020-08-04,catreidtv,,Really impressed by the @KCElectionBd precautions at my polling place. Stylus pen was thrown into a bucket to be cleaned after use. Plexiglass shields between poll workers and voters. Workers in masks and gloves #COVID19 #primaryelection #moleg #voting pic.twitter.com/Jd8l3D6zRG,3,35,"['COVID19', 'primaryelection', 'moleg', 'voting']",Really impressed by the precautions at my polling place. Stylus pen was thrown into a bucket to be cleaned after use. Plexiglass shields between poll workers and voters. Workers in masks and gloves,"['realli', 'impress', 'precaut', 'poll', 'place', 'stylu', 'pen', 'thrown', 'bucket', 'clean', 'use', 'plexiglass', 'shield', 'poll', 'worker', 'voter', 'worker', 'mask', 'glove']",0,en,
115,115,1290608846155788291,2020-08-04,stlcitygov,,Good morning St. Louis and happy #ElectionDay 🗳 The polls are now open until 7 pm. Please follow @stl_board for updates. 📍 You can use this link to find your polling place as some have moved due to #covid19. And don’t forget your mask! … pic.twitter.com/XAgUJzNRHt,3,5,"['ElectionDay', 'covid19']",Good morning St. Louis and happy The polls are now open until pm. Please follow for updates. You can use this link to find your polling place as some have moved due to . And dont forget your mask!,"['good', 'morn', 'st.', 'loui', 'happi', 'the', 'poll', 'open', 'pm', 'pleas', 'follow', 'updat', 'you', 'use', 'link', 'find', 'poll', 'place', 'move', 'due', 'and', 'dont', 'forget', 'mask', '!']",0,en,
