,Unnamed: 0,tweet_id,date,screen_name,location,tweet,retweet_count,favourites_count,hashtags,clean_tweet,processed_tweet,followers_count,language,verified
39,39,1292984651699703808,2020-08-10,charlienelms,,"Several weeks ago I tweeted that COVID19 is not a hoax and encouraged ppl to follow CDC guidelines on masks, distancing & hand washing. Today, my brother, Rev. Roy Nelms, succumbed to the virus. Physically gone but will always present in our hearts. He touched countless lives...",11,160,[],"Several weeks ago I tweeted that COVID19 is not a hoax and encouraged ppl to follow CDC guidelines on masks, distancing & hand washing. Today, my brother, Rev. Roy Nelms, succumbed to the virus. Physically gone but will always present in our hearts. He touched countless lives...","['sever', 'week', 'ago', 'tweet', 'covid19', 'hoax', 'encourag', 'ppl', 'follow', 'cdc', 'guidelin', 'mask', 'distanc', '&', 'hand', 'wash', 'today', 'brother', 'rev', 'roy', 'nelm', 'succumb', 'viru', 'physic', 'gone', 'alway', 'present', 'heart', 'He', 'touch', 'countless', 'live', '...']",0,en,
40,40,1292834429145055232,2020-08-10,j_shackelford,,"Today’s a great day for @GovParsonMO to issue a 4-6 week statewide mask mandate. We must do all we can to flatten the curve, lower our case numbers, and stop the spread of #COVID19 This will help our: - Schools, students, and teachers - Econony, businesses, and employees",13,50,['COVID19'],"Todays a great day for to issue a -6 week statewide mask mandate. We must do all we can to flatten the curve, lower our case numbers, and stop the spread of This will help our: - Schools, students, and teachers - Econony, businesses, and employees","['today', 'great', 'day', 'issu', '-6', 'week', 'statewid', 'mask', 'mandat', 'We', 'must', 'flatten', 'curv', 'lower', 'case', 'number', 'stop', 'spread', 'thi', 'help', ':', '-', 'school', 'student', 'teacher', '-', 'econoni', 'busi', 'employe']",0,en,
41,41,1292786081906270208,2020-08-10,jsfreed,,21 people shot. A gathering of 100s wo masks that violated #COVID19 restrictions. Cops on the scene from start of party. And @ChmnMendelson says there’s nothing we can do to keep people safe. 1/ …,0,1,['COVID19'],people shot. A gathering of s wo masks that violated restrictions. Cops on the scene from start of party. And says theres nothing we can do to keep people safe. /,"['peopl', 'shot', 'A', 'gather', 'wo', 'mask', 'violat', 'restrict', 'cop', 'scene', 'start', 'parti', 'and', 'say', 'there', 'noth', 'keep', 'peopl', 'safe', '/']",0,en,
42,42,1292688362760015874,2020-08-10,twwest60,,"Not a privilege. If it was a privilege, he wouldn’t have had to pay for it. And remember, that mask to Covid19 is like a chain link fence to a mosquito. Hence, social distancing. O2 levels already reduced in the cabin, then add the mask? To AA, the dollar trumps distancing.",0,33,[],"Not a privilege. If it was a privilege, he wouldnt have had to pay for it. And remember, that mask to Covid19 is like a chain link fence to a mosquito. Hence, social distancing. O2 levels already reduced in the cabin, then add the mask? To AA, the dollar trumps distancing.","['not', 'privileg', 'If', 'privileg', 'wouldnt', 'pay', 'and', 'rememb', 'mask', 'covid19', 'like', 'chain', 'link', 'fenc', 'mosquito', 'henc', 'social', 'distanc', 'O2', 'level', 'alreadi', 'reduc', 'cabin', 'add', 'mask', 'To', 'AA', 'dollar', 'trump', 'distanc']",0,en,
43,43,1292687690492784646,2020-08-10,gointocanada,,"There’s just, I want to say so much stupidity, but I’m not sure if that’s fair. Like teens having #COVID19 parties, 250k motorcyclists w/no masks in SD, adults having family parties, eating in restaurants... Is it stupid or just REALLY gullible/naive?🤷‍♀️",0,0,['COVID19'],"Theres just, I want to say so much stupidity, but Im not sure if thats fair. Like teens having parties, k motorcyclists w/no masks in SD, adults having family parties, eating in restaurants... Is it stupid or just REALLY gullible/naive?","['there', 'want', 'say', 'much', 'stupid', 'Im', 'sure', 'that', 'fair', 'like', 'teen', 'parti', 'k', 'motorcyclist', 'w/no', 'mask', 'SD', 'adult', 'famili', 'parti', 'eat', 'restaur', '...', 'Is', 'stupid', 'realli', 'gullible/na']",0,en,
44,44,1297216963580747777,2020-08-22,drleanawen,,A @JAMA_current study of breastmilk & #covid19: SARS-CoV-2 does not appear to be transmitted via breastmilk. Good news given the benefits of breastfeeding! Nursing moms with #covid19 should wear masks + wash hands & pump parts well. …,70,231,"['covid19', 'covid19']",A study of breastmilk & : SARS-CoV-2 does not appear to be transmitted via breastmilk. Good news given the benefits of breastfeeding! Nursing moms with should wear masks + wash hands & pump parts well.,"['A', 'studi', 'breastmilk', '&', ':', 'sars-cov-2', 'appear', 'transmit', 'via', 'breastmilk', 'good', 'news', 'given', 'benefit', 'breastfeed', '!', 'nurs', 'mom', 'wear', 'mask', '+', 'wash', 'hand', '&', 'pump', 'part', 'well']",0,en,
45,45,1297156567683354625,2020-08-22,governortomwolf,,Mask-wearing is crucial to stop the spread of #COVID19. No mask = no service. pic.twitter.com/deT39y94OV,312,1679,['COVID19'],Mask-wearing is crucial to stop the spread of . No mask = no service.,"['mask-wear', 'crucial', 'stop', 'spread', 'No', 'mask', '=', 'servic']",0,en,
46,46,1297291204049227779,2020-08-22,cdcgov,,"We must continue to help slow the spread of #COVID19 for ourselves, our loved ones, and our future. Do your part and wear a mask, stay 6 feet away from others, and wash your hands. Learn more: . pic.twitter.com/mNhwhWC688",272,548,['COVID19'],"We must continue to help slow the spread of for ourselves, our loved ones, and our future. Do your part and wear a mask, stay feet away from others, and wash your hands. Learn more: .","['We', 'must', 'continu', 'help', 'slow', 'spread', 'love', 'one', 'futur', 'Do', 'part', 'wear', 'mask', 'stay', 'feet', 'away', 'other', 'wash', 'hand', 'learn', ':']",0,en,
47,47,1297117952324579330,2020-08-22,mikeandersonsr,,"Roughly 5 million Americans have tested positive for #COVID19. 98% have recovered. <200,000 have died. More than 320,000,000 Americans are unaffected. Joe Biden and the Democrats want the 320 million to shelter at home, wear a mask, & shut down the entire country. Stupidity.",116,171,['COVID19'],"Roughly million Americans have tested positive for . % have recovered. <200,000 have died. More than Americans are unaffected. Joe Biden and the Democrats want the million to shelter at home, wear a mask, & shut down the entire country. Stupidity.","['roughli', 'million', 'american', 'test', 'posit', '%', 'recov', '<', '200,000', 'die', 'more', 'american', 'unaffect', 'joe', 'biden', 'democrat', 'want', 'million', 'shelter', 'home', 'wear', 'mask', '&', 'shut', 'entir', 'countri', 'stupid']",0,en,
48,48,1297316980534521856,2020-08-22,picardonhealth,,.@WHO says children aged 12 and over should wear masks😷 like adults via ⁦@globeandmail⁩ #Covid19 #MasksForAll …,103,160,"['Covid19', 'MasksForAll']",. says children aged and over should wear masks like adults via,"['say', 'children', 'age', 'wear', 'mask', 'like', 'adult', 'via']",0,en,
49,49,1297078345914634240,2020-08-22,fallysombonkhwa,,wef: 5 myths about face masks under the microscope #COVID19 #masks pic.twitter.com/kWruJhFH7L,0,0,"['COVID19', 'masks']",wef: myths about face masks under the microscope,"['wef', ':', 'myth', 'face', 'mask', 'microscop']",0,en,
50,50,1297138576459694080,2020-08-22,cloneywill,,#COVID19 please bin your masks correctly.. 😡😡 pic.twitter.com/tCzpsMk2da,2,8,['COVID19'],please bin your masks correctly..,"['pleas', 'bin', 'mask', 'correctli', '..']",0,en,
51,51,1297196527300091905,2020-08-22,cagsil,,"#COVID19 - Biggest COVER-UP for wireless transmissions boost to #5G! COVID19 is a side-effect on public. Coinciding with a public wearing masks, regardless of being inside buildings or not, work with #5G to weaken immune systems, and make even more people sick. Being #Poisoned! pic.twitter.com/ny0ATC4wTz",3,8,"['COVID19', '5G', '5G', 'Poisoned']","- Biggest COVER-UP for wireless transmissions boost to ! COVID19 is a side-effect on public. Coinciding with a public wearing masks, regardless of being inside buildings or not, work with to weaken immune systems, and make even more people sick. Being !","['-', 'biggest', 'cover-up', 'wireless', 'transmiss', 'boost', '!', 'covid19', 'side-effect', 'public', 'coincid', 'public', 'wear', 'mask', 'regardless', 'insid', 'build', 'work', 'weaken', 'immun', 'system', 'make', 'even', 'peopl', 'sick', 'be', '!']",0,en,
52,52,1297186635881361409,2020-08-22,bogochisaac,,"For those who are sending me messages regarding schools and #COVID19 – please first have a look online at how I’ve advocated/discussed the need for physical distancing, mask wearing, sanitation, etc to facilitate plans to return safely. These are pretty easy to find.",71,571,['COVID19'],"For those who are sending me messages regarding schools and please first have a look online at how Ive advocated/discussed the need for physical distancing, mask wearing, sanitation, etc to facilitate plans to return safely. These are pretty easy to find.","['for', 'send', 'messag', 'regard', 'school', 'pleas', 'first', 'look', 'onlin', 'ive', 'advocated/discuss', 'need', 'physic', 'distanc', 'mask', 'wear', 'sanit', 'etc', 'facilit', 'plan', 'return', 'safe', 'these', 'pretti', 'easi', 'find']",0,en,
53,53,1297159250301648896,2020-08-22,cityofatlanta,,Don’t forget your mask if you have to leave the house today! It’s a small act that goes a long way to fight #COVID19 and keep your neighbors safe. #ATLStrong pic.twitter.com/9LaShAP8mB,67,177,"['COVID19', 'ATLStrong']",Dont forget your mask if you have to leave the house today! Its a small act that goes a long way to fight and keep your neighbors safe.,"['dont', 'forget', 'mask', 'leav', 'hous', 'today', '!', 'it', 'small', 'act', 'goe', 'long', 'way', 'fight', 'keep', 'neighbor', 'safe']",0,en,
54,54,1297160463000784903,2020-08-22,israelmarrero10,,"""I CAN'T SLEEP ""every time I can't paying my bills. I can't sleep. time people are died of covid19. I can't sleep.time the police get defunding I can't sleep.time the political party don't care. can't sleep. time I wear face mask I can't sleep .time I wake up ""I can't sleep""!!? pic.twitter.com/e7xHPm4LgA",0,0,[],"""I CAN'T SLEEP ""every time I can't paying my bills. I can't sleep. time people are died of covid19. I can't sleep.time the police get defunding I can't sleep.time the political party don't care. can't sleep. time I wear face mask I can't sleep .time I wake up ""I can't sleep""!!?","['``', 'CA', ""n't"", 'sleep', '``', 'everi', 'time', 'ca', ""n't"", 'pay', 'bill', 'ca', ""n't"", 'sleep', 'time', 'peopl', 'die', 'covid19', 'ca', ""n't"", 'sleep.tim', 'polic', 'get', 'defund', 'ca', ""n't"", 'sleep.tim', 'polit', 'parti', ""n't"", 'care', 'ca', ""n't"", 'sleep', 'time', 'wear', 'face', 'mask', 'ca', ""n't"", 'sleep', '.time', 'wake', '``', 'ca', ""n't"", 'sleep', ""''"", '!', '!']",0,en,
55,55,1297054574453428224,2020-08-22,scotthotlanta,,I watch a lot of #LawAndOrder it seems to me that someone who can not know if they are positive for #COVID19 Is like someone who does not know if their pistol is loaded. Not wearing a mask is pointing a pistol at me. That is attempted depraved indifference murder 2. Hook ‘em up.,0,1,"['LawAndOrder', 'COVID19']",I watch a lot of it seems to me that someone who can not know if they are positive for Is like someone who does not know if their pistol is loaded. Not wearing a mask is pointing a pistol at me. That is attempted depraved indifference murder . Hook em up.,"['watch', 'lot', 'seem', 'someon', 'know', 'posit', 'Is', 'like', 'someon', 'know', 'pistol', 'load', 'not', 'wear', 'mask', 'point', 'pistol', 'that', 'attempt', 'deprav', 'indiffer', 'murder', 'hook', 'em']",0,en,
56,56,1297036333580341249,2020-08-22,kimgtrue2me,,"How ignorant can people be to continue to support the man who doesn't do a damn thing to get rid of #COVID19! Do you like loved ones dying, no school, sports, or entertainment, wearing a mask, no parties, graduations? Why continue vote for someone who refuses to end covid19?",0,0,['COVID19'],"How ignorant can people be to continue to support the man who doesn't do a damn thing to get rid of ! Do you like loved ones dying, no school, sports, or entertainment, wearing a mask, no parties, graduations? Why continue vote for someone who refuses to end covid19?","['how', 'ignor', 'peopl', 'continu', 'support', 'man', ""n't"", 'damn', 'thing', 'get', 'rid', '!', 'Do', 'like', 'love', 'one', 'die', 'school', 'sport', 'entertain', 'wear', 'mask', 'parti', 'graduat', 'whi', 'continu', 'vote', 'someon', 'refus', 'end', 'covid19']",0,en,
57,57,1294077188187344896,2020-08-13,georganneb,,News flash. I don't care how many #COVID19 cases there are. I don't want to hear any more about masks or social distancing. I'm tired. Fed up. This constant fear mongering and suppression of rights is exhausting. Time to get back to living.,23,84,['COVID19'],News flash. I don't care how many cases there are. I don't want to hear any more about masks or social distancing. I'm tired. Fed up. This constant fear mongering and suppression of rights is exhausting. Time to get back to living.,"['new', 'flash', ""n't"", 'care', 'mani', 'case', ""n't"", 'want', 'hear', 'mask', 'social', 'distanc', ""'m"", 'tire', 'fed', 'thi', 'constant', 'fear', 'monger', 'suppress', 'right', 'exhaust', 'time', 'get', 'back', 'live']",0,en,
58,58,1292274725570387969,2020-08-08,alicesim,,If you’re interested in making your own mask or purchasing a fabric mask - #WHO has released the latest evidence on the ideal 3-layer mask composition and materials #masks #COVID19 …,13,31,"['WHO', 'masks', 'COVID19']",If youre interested in making your own mask or purchasing a fabric mask - has released the latest evidence on the ideal -layer mask composition and materials,"['If', 'your', 'interest', 'make', 'mask', 'purchas', 'fabric', 'mask', '-', 'releas', 'latest', 'evid', 'ideal', '-layer', 'mask', 'composit', 'materi']",0,en,
59,59,1292196522243706880,2020-08-08,damonmotzstorey,,"I wear a mask every day, @OregonGovBrown, but I cannot do anything about #COVID19 hotspots in our state prisons. Only you can fix that. Lawmakers gave you a list of safe release criteria that apply to 2,000 inmates. You commuted 57 sentences. It's time to step up and do more. …",25,56,['COVID19'],"I wear a mask every day, , but I cannot do anything about hotspots in our state prisons. Only you can fix that. Lawmakers gave you a list of safe release criteria that apply to inmates. You commuted sentences. It's time to step up and do more.","['wear', 'mask', 'everi', 'day', 'anyth', 'hotspot', 'state', 'prison', 'onli', 'fix', 'lawmak', 'gave', 'list', 'safe', 'releas', 'criteria', 'appli', 'inmat', 'you', 'commut', 'sentenc', 'It', ""'s"", 'time', 'step']",0,en,
60,60,1292231540739645441,2020-08-08,murphelaw,,I took a drive through #OldOrchardBeach this afternoon. All the motel parking lots were full. All the “No Vacancy” signs were lit up. The sidewalks were packed with pedestrians. Physical distancing was impossible. I didn’t see a single mask. Not one. #MEpolitics #COVID19 #OOB,2,17,"['OldOrchardBeach', 'MEpolitics', 'COVID19', 'OOB']",I took a drive through this afternoon. All the motel parking lots were full. All the No Vacancy signs were lit up. The sidewalks were packed with pedestrians. Physical distancing was impossible. I didnt see a single mask. Not one.,"['took', 'drive', 'afternoon', 'all', 'motel', 'park', 'lot', 'full', 'all', 'No', 'vacanc', 'sign', 'lit', 'the', 'sidewalk', 'pack', 'pedestrian', 'physic', 'distanc', 'imposs', 'didnt', 'see', 'singl', 'mask', 'not', 'one']",0,en,
61,61,1292098166641381377,2020-08-08,jblasconyc,,"Aside from the lack of mask facing we saw, thank you @BellevueHosp for our #COVID19 test. 3rd test in the past 4 months. Make it a routine! There was a 1.5 hour wait but we stayed. pic.twitter.com/bDI1mX2Qn4",2,13,['COVID19'],"Aside from the lack of mask facing we saw, thank you for our test. rd test in the past months. Make it a routine! There was a hour wait but we stayed.","['asid', 'lack', 'mask', 'face', 'saw', 'thank', 'test', 'rd', 'test', 'past', 'month', 'make', 'routin', '!', 'there', 'hour', 'wait', 'stay']",0,en,
62,62,1292067737003581441,2020-08-08,thebrandihaynie,,The English teacher in me is in need of this mask 😂 #COVID19 #teacherhumor #facemasks pic.twitter.com/u3WmZqkxQ5,0,13,"['COVID19', 'teacherhumor', 'facemasks']",The English teacher in me is in need of this mask,"['the', 'english', 'teacher', 'need', 'mask']",0,en,
63,63,1292047446076469248,2020-08-08,christianne67,,"No masks required as 250,000 expected at 10-day Sturgis Motorcycle Rally … Here's what to know; they're idiots @ArcheeDebunker #PublicHealth 😷 #COVID19 #Sturgis2020 🗳 #VoteOutThegop #tRumpTrainWreck ⚰ #MaskItOrCasket #SocialDistancing ☠ #COVIDIOTS pic.twitter.com/dCdcHjhByi",8,9,"['PublicHealth', 'COVID19', 'Sturgis2020', 'VoteOutThegop', 'tRumpTrainWreck', 'MaskItOrCasket', 'SocialDistancing', 'COVIDIOTS']",No masks required as expected at -day Sturgis Motorcycle Rally Here's what to know; they're idiots,"['No', 'mask', 'requir', 'expect', '-day', 'sturgi', 'motorcycl', 'ralli', 'here', ""'s"", 'know', ""'re"", 'idiot']",0,en,
64,64,1292012325814382593,2020-08-08,samxquinn,Tacology 101,"Sangamon County’s already one of thirteen (I believe) counties that have been placed at a “warning level” from the state. Yet no masks or distancing are mandated, enforced by the local police. #COVID19 #springfieldIL @217Problems pic.twitter.com/P2G1n3iKTT – at Tacology 101",3,11,"['COVID19', 'springfieldIL']","Sangamon Countys already one of thirteen (I believe) counties that have been placed at a warning level from the state. Yet no masks or distancing are mandated, enforced by the local police. at Tacology","['sangamon', 'counti', 'alreadi', 'one', 'thirteen', 'believ', 'counti', 'place', 'warn', 'level', 'state', 'yet', 'mask', 'distanc', 'mandat', 'enforc', 'local', 'polic', 'tacolog']",0,en,
65,65,1291964369862111232,2020-08-08,byrdtonia,,"But the interaction will not be the same as before COVID19. Most schools are requiring masks, six feet apart at all times, no sharing of materials -- kids mainly just looking at others. My son is fine with interacting with his friends via PS4 and other tech outlets until safer.",0,0,[],"But the interaction will not be the same as before COVID19. Most schools are requiring masks, six feet apart at all times, no sharing of materials -- kids mainly just looking at others. My son is fine with interacting with his friends via PS4 and other tech outlets until safer.","['but', 'interact', 'covid19', 'most', 'school', 'requir', 'mask', 'six', 'feet', 'apart', 'time', 'share', 'materi', '--', 'kid', 'mainli', 'look', 'other', 'My', 'son', 'fine', 'interact', 'friend', 'via', 'ps4', 'tech', 'outlet', 'safer']",0,en,
66,66,1291415061714665475,2020-08-06,mikenormandirt,,How in the world did @GovMikeDeWine get covid19 if he was wearing a mask and social distancing and doing everything he says works to stop the spread?,9,160,[],How in the world did get covid19 if he was wearing a mask and social distancing and doing everything he says works to stop the spread?,"['how', 'world', 'get', 'covid19', 'wear', 'mask', 'social', 'distanc', 'everyth', 'say', 'work', 'stop', 'spread']",0,en,
67,67,1291327328761581568,2020-08-06,unrealbluegrass,,America has a short span of attention except during war. COVID19 surprised our psyche. Some knee jerkers wanted to believe this disease was just a breeze. It now sits stagnant over the world. Take a breath through your mask and be patient and prudent.,8,45,[],America has a short span of attention except during war. COVID19 surprised our psyche. Some knee jerkers wanted to believe this disease was just a breeze. It now sits stagnant over the world. Take a breath through your mask and be patient and prudent.,"['america', 'short', 'span', 'attent', 'except', 'war', 'covid19', 'surpris', 'psych', 'some', 'knee', 'jerker', 'want', 'believ', 'diseas', 'breez', 'It', 'sit', 'stagnant', 'world', 'take', 'breath', 'mask', 'patient', 'prudent']",0,en,
68,68,1291271764383735808,2020-08-06,ellenkuwana,,"Maybe in reverse: kids in costumes stand in their doorways and masked adults walk down streets w candy, keeping apart, and throw candy at the open doorways? #Halloween in the time of #COVID19 @JRMorber …",0,0,"['Halloween', 'COVID19']","Maybe in reverse: kids in costumes stand in their doorways and masked adults walk down streets w candy, keeping apart, and throw candy at the open doorways? in the time of","['mayb', 'revers', ':', 'kid', 'costum', 'stand', 'doorway', 'mask', 'adult', 'walk', 'street', 'w', 'candi', 'keep', 'apart', 'throw', 'candi', 'open', 'doorway', 'time']",0,en,
69,69,1291237965797023744,2020-08-06,sharleesmad,,"Omg this kid is a hero ,and the school should be shut down for not keeping their students safe .there needs to be more people taking vids and pics of people not wearing masks,having huge parties .just crazy trump. Supporters who believe they won't catch covid19 karma is a ...",1,3,[],"Omg this kid is a hero ,and the school should be shut down for not keeping their students safe .there needs to be more people taking vids and pics of people not wearing masks,having huge parties .just crazy trump. Supporters who believe they won't catch covid19 karma is a ...","['omg', 'kid', 'hero', 'school', 'shut', 'keep', 'student', 'safe', '.there', 'need', 'peopl', 'take', 'vid', 'pic', 'peopl', 'wear', 'mask', 'huge', 'parti', '.just', 'crazi', 'trump', 'support', 'believ', 'wo', ""n't"", 'catch', 'covid19', 'karma', '...']",0,en,
70,70,1297582121167523841,2020-08-23,cdcgov,,#DYK? Your mask should cover your nose AND mouth to help protect others and slow the spread of #COVID19. Learn how to wear your mask correctly. #WearAMask #DoYourPart pic.twitter.com/CewXaxWUAB,518,609,"['DYK', 'COVID19', 'WearAMask', 'DoYourPart']",? Your mask should cover your nose AND mouth to help protect others and slow the spread of . Learn how to wear your mask correctly.,"['your', 'mask', 'cover', 'nose', 'and', 'mouth', 'help', 'protect', 'other', 'slow', 'spread', 'learn', 'wear', 'mask', 'correctli']",0,en,
71,71,1297549417311096838,2020-08-23,montyboa99,,"POUTS, you haven't cared about: - funding for testing centers - mfg and distribution of PPE - obtaining readily-available, quick-turnaround test kits from WHO - mandatory mask orders - safe reopening Now we're supposed to think you care about ""#COVID19-sanitized"" dropboxes? pic.twitter.com/Rdu9QrT9aE",41,99,['COVID19'],"POUTS, you haven't cared about: - funding for testing centers - mfg and distribution of PPE - obtaining readily-available, quick-turnaround test kits from WHO - mandatory mask orders - safe reopening Now we're supposed to think you care about ""-sanitized"" dropboxes?","['pout', ""n't"", 'care', ':', '-', 'fund', 'test', 'center', '-', 'mfg', 'distribut', 'ppe', '-', 'obtain', 'readily-avail', 'quick-turnaround', 'test', 'kit', 'who', '-', 'mandatori', 'mask', 'order', '-', 'safe', 'reopen', 'now', ""'re"", 'suppos', 'think', 'care', '``', '-sanit', ""''"", 'dropbox']",0,en,
72,72,1297549611591245827,2020-08-23,henrycountyhd,,We can all help our kids be more comfortable with wearing their mask during the school day. #COVID19 #ProtectingHenryCounty pic.twitter.com/dp1NddtZw5,2,0,"['COVID19', 'ProtectingHenryCounty']",We can all help our kids be more comfortable with wearing their mask during the school day.,"['We', 'help', 'kid', 'comfort', 'wear', 'mask', 'school', 'day']",0,en,
73,73,1297520585656811521,2020-08-23,vivekdasilva,,Seriously? How heavy is a mask to carry?? #covid19 #masks #stannespark pic.twitter.com/6VtibVblL1,2,13,"['covid19', 'masks', 'stannespark']",Seriously? How heavy is a mask to carry??,"['serious', 'how', 'heavi', 'mask', 'carri']",0,en,
74,74,1297492044248752128,2020-08-23,palomitica29,,My new normal: the characters in my dreams wear masks. Does anyone else have pandemic dreams? Or should I call them nightmares? #COVID19,0,6,['COVID19'],My new normal: the characters in my dreams wear masks. Does anyone else have pandemic dreams? Or should I call them nightmares?,"['My', 'new', 'normal', ':', 'charact', 'dream', 'wear', 'mask', 'doe', 'anyon', 'els', 'pandem', 'dream', 'Or', 'call', 'nightmar']",0,en,
75,75,1297434326523576321,2020-08-23,cazza1h,,"What exactly is the guidance now for Covid? 2m and 1m+ and face masks I know, but as for the rest the gov website doesn't set it out clearly to me, think the public need some clarity #COVID19 @MattHancock @CMO_England",0,0,['COVID19'],"What exactly is the guidance now for Covid? m and m+ and face masks I know, but as for the rest the gov website doesn't set it out clearly to me, think the public need some clarity","['what', 'exactli', 'guidanc', 'covid', 'm+', 'face', 'mask', 'know', 'rest', 'gov', 'websit', ""n't"", 'set', 'clearli', 'think', 'public', 'need', 'clariti']",0,en,
76,76,1297398658573328385,2020-08-23,warconspiracies,,If you deal in asbestos and are wearing a mask having a beard fibres can move through the beard that's why you need full cover of your face. I wonder if it's the same as #COVID19,0,2,['COVID19'],If you deal in asbestos and are wearing a mask having a beard fibres can move through the beard that's why you need full cover of your face. I wonder if it's the same as,"['If', 'deal', 'asbesto', 'wear', 'mask', 'beard', 'fibr', 'move', 'beard', ""'s"", 'need', 'full', 'cover', 'face', 'wonder', ""'s""]",0,en,
