,Unnamed: 0,Unnamed: 0.1,Unnamed: 0.1.1,date,favourites_count,followers_count,language,location,retweet_count,screen_name,tweet,tweet_id,verified,hashtags,clean_tweet,processed_tweet
184,184,184,184,2020-04-12 04:14:55,507.0,31620.0,en,"Washington, DC",16.0,TomBossert,"In cumulative deaths per million, from syndrome surveillance pulled by a colleague, the US is doing better than Spain, France, Italy, UK &amp; Sweden. Germany doing better than the US. Czech Republic doing really well (likely b/c they wear masks). The US is tracking just below Wuhan.",1.249189228547838e+18,1.0,[],"In cumulative deaths per million, from syndrome surveillance pulled by a colleague, the US is doing better than Spain, France, Italy, UK &amp; Sweden. Germany doing better than the US. Czech Republic doing really well (likely b/c they wear masks). The US is tracking just below Wuhan.","['In', 'cumul', 'death', 'per', 'million', 'syndrom', 'surveil', 'pull', 'colleagu', 'US', 'better', 'spain', 'franc', 'itali', 'UK', '&', 'amp', 'sweden', 'germani', 'better', 'US', 'czech', 'republ', 'realli', 'well', 'like', 'b/c', 'wear', 'mask', 'the', 'US', 'track', 'wuhan']"
185,185,185,185,2020-04-12 04:15:41,35066.0,826.0,en,"San Francisco, CA",1.0,odbol,@mekkaokereke NYC Covid casualties has already surpassed 9/11. Imagine if we spent the same trillions of dollars on masks and hospitals that we did on the military's response to 9/11,1.2491894193300234e+18,0.0,[],NYC Covid casualties has already surpassed /11. Imagine if we spent the same trillions of dollars on masks and hospitals that we did on the military's response to /11,"['nyc', 'covid', 'casualti', 'alreadi', 'surpass', '/11', 'imagin', 'spent', 'trillion', 'dollar', 'mask', 'hospit', 'militari', ""'s"", 'respons', '/11']"
186,186,186,186,2020-04-12 04:15:45,26524.0,13770.0,en,"Minneapolis, MN",0.0,allevin18,"My favorite part of this video is @RepMattGaetz's comment, ""I was making a point [by wearing the gas mask] that we should be concerned about it [#COVID19] because as Congressmen we go through the dirtiest airports..."" Holy sh**. Really? REALLY?",1.2491894394458972e+18,0.0,['COVID19'],"My favorite part of this video is 's comment, ""I was making a point [by wearing the gas mask] that we should be concerned about it [] because as Congressmen we go through the dirtiest airports..."" Holy sh**. Really? REALLY?","['My', 'favorit', 'part', 'video', ""'s"", 'comment', '``', 'make', 'point', 'wear', 'ga', 'mask', 'concern', 'congressmen', 'go', 'dirtiest', 'airport', '...', ""''"", 'holi', 'sh', '*', '*', 'realli', 'realli']"
187,187,187,187,2020-04-12 04:16:54,7260.0,382.0,en,Los Angeles,0.0,LoyalStingray,"@nytimes I mean, there's always this: “We are lucky to have quarantine measures in place now,” she said. “People stay at home, walk less and wear masks,” anyway, because of the coronavirus threat. Eh? 🤷‍♀️",1.2491897290332365e+18,0.0,[],"I mean, there's always this: We are lucky to have quarantine measures in place now, she said. People stay at home, walk less and wear masks, anyway, because of the coronavirus threat. Eh?","['mean', ""'s"", 'alway', ':', 'We', 'lucki', 'quarantin', 'measur', 'place', 'said', 'peopl', 'stay', 'home', 'walk', 'less', 'wear', 'mask', 'anyway', 'coronaviru', 'threat', 'Eh']"
188,188,188,188,2020-04-12 04:18:29,91389.0,2569.0,en,"San Francisco Bay Area, CA",347.0,ArmandDoma,RT @adamelmahrek: A powerful California union had a miraculous find: 39 million N95 masks for healthcare workers fighting coronavirus. But…,1.2491901269509816e+18,0.0,[],: A powerful California union had a miraculous find: million N95 masks for healthcare workers fighting coronavirus. But,"[':', 'A', 'power', 'california', 'union', 'miracul', 'find', ':', 'million', 'n95', 'mask', 'healthcar', 'worker', 'fight', 'coronaviru', 'but']"
189,189,189,189,2020-04-12 04:21:48,186484.0,4345.0,en,"New Jersey, USA",8.0,tb_terry,RT @MoomjyN: The first ER doctor to die from the coronavirus in the US said he was infected because he had to wear the same mask 4 days in…,1.2491909626409288e+18,0.0,[],: The first ER doctor to die from the coronavirus in the US said he was infected because he had to wear the same mask days in,"[':', 'the', 'first', 'ER', 'doctor', 'die', 'coronaviru', 'US', 'said', 'infect', 'wear', 'mask', 'day']"
190,190,190,190,2020-04-12 04:24:14,7297.0,253.0,en,"Chicago, Il",0.0,tommylama,Anyone else paranoid about wearing a mask while walking into the liquor store? I’m not trying to have the cops called on me and end up getting shot. #shoppingwhileblack #coronavirus #Masks,1.2491915739439882e+18,0.0,"['shoppingwhileblack', 'coronavirus', 'Masks']",Anyone else paranoid about wearing a mask while walking into the liquor store? Im not trying to have the cops called on me and end up getting shot.,"['anyon', 'els', 'paranoid', 'wear', 'mask', 'walk', 'liquor', 'store', 'Im', 'tri', 'cop', 'call', 'end', 'get', 'shot']"
191,191,191,191,2020-04-12 04:27:06,36912.0,2913.0,en,"Pontiac, MI",15.0,massagedocMI,RT @EconomicTimes: COVID-19 Pandemic: Women constables sew masks for needy at Delhi police station | Track LIVE Updates on the coronavirus…,1.2491922955194368e+18,0.0,[],: COVID-19 Pandemic: Women constables sew masks for needy at Delhi police station | Track LIVE Updates on the coronavirus,"[':', 'covid-19', 'pandem', ':', 'women', 'constabl', 'sew', 'mask', 'needi', 'delhi', 'polic', 'station', '|', 'track', 'live', 'updat', 'coronaviru']"
192,192,192,192,2020-04-26 04:01:04,34892.0,672.0,en,New York City,9740.0,MWChin,"RT @joncoopertweets: Medical supplier says FEMA seized 400,000 N95 masks destined for medical workers during the coronavirus pandemic, and…",1.2542591712661217e+18,0.0,[],": Medical supplier says FEMA seized N95 masks destined for medical workers during the coronavirus pandemic, and","[':', 'medic', 'supplier', 'say', 'fema', 'seiz', 'n95', 'mask', 'destin', 'medic', 'worker', 'coronaviru', 'pandem']"
193,193,193,193,2020-04-26 04:02:28,3723.0,45.0,en,"Chicago, IL",87.0,masonjarnard,RT @RampCapitalLLC: On the next episode of House Hunters: My wife makes customized coronavirus masks for cats. I host virtual clown parti…,1.2542595272198963e+18,0.0,[],: On the next episode of House Hunters: My wife makes customized coronavirus masks for cats. I host virtual clown parti,"[':', 'On', 'next', 'episod', 'hous', 'hunter', ':', 'My', 'wife', 'make', 'custom', 'coronaviru', 'mask', 'cat', 'host', 'virtual', 'clown', 'parti']"
194,194,194,194,2020-04-26 04:02:55,82.0,2004.0,en,"East Brunswick, NJ",0.0,NewExpressNews,Coronavirus: Making face masks feels ‘like the war effort’,1.254259640000557e+18,0.0,[],Coronavirus: Making face masks feels like the war effort,"['coronaviru', ':', 'make', 'face', 'mask', 'feel', 'like', 'war', 'effort']"
195,195,195,195,2020-04-26 04:03:01,20679.0,427.0,en,"Los Angeles, CA",0.0,LaRaidergal,@lookner heard your elevator story oh my gosh. Glad you were wearing a mask. I wonder if that guy really works at a hospital &amp; if he does probably in an area that you don’t see the #COVID19 kaos. Most hospitals are empty &amp; available for #COVID19 but his ignorance is appalling,1.25425966518297e+18,0.0,"['COVID19', 'COVID19']",heard your elevator story oh my gosh. Glad you were wearing a mask. I wonder if that guy really works at a hospital &amp; if he does probably in an area that you dont see the kaos. Most hospitals are empty &amp; available for but his ignorance is appalling,"['heard', 'elev', 'stori', 'oh', 'gosh', 'glad', 'wear', 'mask', 'wonder', 'guy', 'realli', 'work', 'hospit', '&', 'amp', 'probabl', 'area', 'dont', 'see', 'kao', 'most', 'hospit', 'empti', '&', 'amp', 'avail', 'ignor', 'appal']"
196,196,196,196,2020-04-26 04:05:53,8448.0,402.0,en,NYC,76.0,ChicoBonds,"RT @webosho: @jimcramer Masks do make a difference. In Asian countries where people regularly wore masks anyway before Covid, they had the…",1.2542603835625677e+18,0.0,[],": Masks do make a difference. In Asian countries where people regularly wore masks anyway before Covid, they had the","[':', 'mask', 'make', 'differ', 'In', 'asian', 'countri', 'peopl', 'regularli', 'wore', 'mask', 'anyway', 'covid']"
197,197,197,197,2020-04-26 04:06:36,20540.0,179.0,en,"Bel Air North, MD",3.0,ChaseCantontw,RT @panagis21: We donated masks to a community (🙏@designbytrerese @Zeke_Cohen) Spoke at local masjid regarding #COVID19 (🙏@LovelyMope) Sc…,1.2542605669543158e+18,0.0,['COVID19'],: We donated masks to a community ( ) Spoke at local masjid regarding () Sc,"[':', 'We', 'donat', 'mask', 'commun', 'spoke', 'local', 'masjid', 'regard', 'Sc']"
198,198,198,198,2020-04-26 04:07:35,105553.0,430.0,en,lancaster,172.0,crazynm,"RT @HeyTammyBruce: In the meantime... “NJ police say 'excessive wearing' of coronavirus mask contributed to driver passing out, crashing ca…",1.2542608148836516e+18,0.0,[],": In the meantime... NJ police say 'excessive wearing' of coronavirus mask contributed to driver passing out, crashing ca","[':', 'In', 'meantim', '...', 'NJ', 'polic', 'say', ""'excess"", 'wear', 'coronaviru', 'mask', 'contribut', 'driver', 'pass', 'crash', 'ca']"
199,199,199,199,2020-04-26 04:08:04,1776.0,648.0,en,"Chicago, IL, USA",0.0,doquocanh,"@jdevans141 @Hdiesel503 @joshmich By the way, wearing mask is not seen as too demanding. Many people already do it often, because of air pollution, excessive sunlight &amp; heat, etc. Plus the experience from SARS, H5N1, etc.",1.2542609363718308e+18,0.0,[],"By the way, wearing mask is not seen as too demanding. Many people already do it often, because of air pollution, excessive sunlight &amp; heat, etc. Plus the experience from SARS, H5N1, etc.","['By', 'way', 'wear', 'mask', 'seen', 'demand', 'mani', 'peopl', 'alreadi', 'often', 'air', 'pollut', 'excess', 'sunlight', '&', 'amp', 'heat', 'etc', 'plu', 'experi', 'sar', 'h5n1', 'etc']"
200,200,200,200,2020-04-26 04:08:32,7590.0,271.0,en,Berkeley ,0.0,LindaKazahLocke,@MotherJones California requires masks in grocery stores as of 4/22 @MotherJones. Thank you @GavinNewsom for putting in place measures to keep CA safe. #covid19,1.254261050238632e+18,0.0,['covid19'],California requires masks in grocery stores as of /22 . Thank you for putting in place measures to keep CA safe.,"['california', 'requir', 'mask', 'groceri', 'store', '/22', 'thank', 'put', 'place', 'measur', 'keep', 'CA', 'safe']"
201,201,201,201,2020-04-26 04:10:34,69.0,751.0,en,"Houston, TX",3.0,alphaetalambda,"Please take note of the upcoming mask distributions in Houston City Council Districts A, D, &amp; J. Please share with those who may need them in the area. #COVID19 #MaskUpHOU",1.2542615650728346e+18,0.0,"['COVID19', 'MaskUpHOU']","Please take note of the upcoming mask distributions in Houston City Council Districts A, D, &amp; J. Please share with those who may need them in the area.","['pleas', 'take', 'note', 'upcom', 'mask', 'distribut', 'houston', 'citi', 'council', 'district', 'A', 'D', '&', 'amp', 'J', 'pleas', 'share', 'may', 'need', 'area']"
202,202,202,202,2020-04-26 04:12:18,50861.0,16350.0,en,"California, USA",9.0,Reblyn1963,RT @LASDBrink: Driver in crash may have passed out from wearing N95 mask too long. #COVID19 #CoronaVirus,1.25426200173321e+18,0.0,"['COVID19', 'CoronaVirus']",: Driver in crash may have passed out from wearing N95 mask too long.,"[':', 'driver', 'crash', 'may', 'pass', 'wear', 'n95', 'mask', 'long']"
203,203,203,203,2020-04-26 04:12:18,12866.0,201.0,en,Nope ,0.0,Agadezzz,"So they’re not gonna reopen Philly until we have 50 new covid cases per 100,000 people a day for 14 straight days. Currently we have approx 350 new positives per 100,000 people a day. Why are people gathering in public spaces? Without masks? Youre slowing this whole thing down",1.2542620011839734e+18,0.0,[],So theyre not gonna reopen Philly until we have new covid cases per people a day for straight days. Currently we have approx new positives per people a day. Why are people gathering in public spaces? Without masks? Youre slowing this whole thing down,"['So', 'theyr', 'gon', 'na', 'reopen', 'philli', 'new', 'covid', 'case', 'per', 'peopl', 'day', 'straight', 'day', 'current', 'approx', 'new', 'posit', 'per', 'peopl', 'day', 'whi', 'peopl', 'gather', 'public', 'space', 'without', 'mask', 'your', 'slow', 'whole', 'thing']"
204,204,204,204,2020-04-26 04:12:41,3807.0,348.0,en,"Atlanta, GA",1.0,Ermaccin,A lot of y'all mask strings turning brown behind y'all ears 🤣 Ion like that😩 #coronavirus #QuarantineLife,1.2542620979801416e+18,0.0,"['coronavirus', 'QuarantineLife']",A lot of y'all mask strings turning brown behind y'all ears Ion like that,"['A', 'lot', ""y'all"", 'mask', 'string', 'turn', 'brown', 'behind', ""y'all"", 'ear', 'ion', 'like']"
205,205,205,205,2020-04-26 04:15:02,14497.0,3926.0,en,"Florida, USA",2.0,notComey,"RT @notComey: ‘Lucha libre’ masks converted for coronavirus are coveted COVID-19 protection in Mexico: All around the world, the coronaviru…",1.2542626896997786e+18,0.0,[],": Lucha libre masks converted for coronavirus are coveted COVID-19 protection in Mexico: All around the world, the coronaviru","[':', 'lucha', 'libr', 'mask', 'convert', 'coronaviru', 'covet', 'covid-19', 'protect', 'mexico', ':', 'all', 'around', 'world', 'coronaviru']"
206,206,206,206,2020-04-26 04:15:31,81168.0,1678.0,en,"Crown Point, IN",32.0,JoeyFDRusso1,"RT @JohnnyEAwesome: ☮️😺#AwesomePOLL - Because of the #coronavirus, Are you wearing a face mask 😷 out in public places, such as stores etc. ?",1.2542628105545318e+18,0.0,"['AwesomePOLL', 'coronavirus']",": - Because of the , Are you wearing a face mask out in public places, such as stores etc. ?","[':', '-', 'becaus', 'are', 'wear', 'face', 'mask', 'public', 'place', 'store', 'etc']"
207,207,207,207,2020-04-26 04:15:43,24154.0,75.0,en,"Michigan, USA",0.0,new_meowth_VA,gonna pop on my covid mask and give a gas station attendant a minor fright in the middle of the night while i buy a soda.,1.2542628612553196e+18,0.0,[],gonna pop on my covid mask and give a gas station attendant a minor fright in the middle of the night while i buy a soda.,"['gon', 'na', 'pop', 'covid', 'mask', 'give', 'ga', 'station', 'attend', 'minor', 'fright', 'middl', 'night', 'buy', 'soda']"
208,208,208,208,2020-04-26 04:16:25,11493.0,444.0,en,"New Jersey, USA",0.0,smakr61,I see a lot of people without masks #COVID19 is nothing to be ignored On 4/25 in the AM my family lost a loving caring all around good guy My brother in law 3 wks he suffered #wearyourmask you can be a carrier &amp; not know it like the person who walked into his office without one!,1.2542630366444134e+18,0.0,"['COVID19', 'wearyourmask']",I see a lot of people without masks is nothing to be ignored On /25 in the AM my family lost a loving caring all around good guy My brother in law wks he suffered you can be a carrier &amp; not know it like the person who walked into his office without one!,"['see', 'lot', 'peopl', 'without', 'mask', 'noth', 'ignor', 'On', '/25', 'AM', 'famili', 'lost', 'love', 'care', 'around', 'good', 'guy', 'My', 'brother', 'law', 'wk', 'suffer', 'carrier', '&', 'amp', 'know', 'like', 'person', 'walk', 'offic', 'without', 'one', '!']"
209,209,209,209,2020-04-26 04:16:34,99606.0,408.0,en,"Oregon, USA",4.0,PNW_DrGoose,"RT @LGunderson: Roseburg VA director leads coronavirus dance party without social distancing, face masks",1.254263075219243e+18,0.0,[],": Roseburg VA director leads coronavirus dance party without social distancing, face masks","[':', 'roseburg', 'VA', 'director', 'lead', 'coronaviru', 'danc', 'parti', 'without', 'social', 'distanc', 'face', 'mask']"
210,210,210,210,2020-04-26 04:19:49,5452.0,921.0,en,Forest,14.0,izzykagara,RT @PE_Unit: Niger State Government mandated the use of face mask in public places in order to contain the spread of #COVIDー19 in the state…,1.2542638927773204e+18,0.0,['COVIDー19'],: Niger State Government mandated the use of face mask in public places in order to contain the spread of in the state,"[':', 'niger', 'state', 'govern', 'mandat', 'use', 'face', 'mask', 'public', 'place', 'order', 'contain', 'spread', 'state']"
211,211,211,211,2020-04-26 04:20:38,36912.0,2913.0,en,"Pontiac, MI",48.0,massagedocMI,RT @allinwithchris: Why wearing a mask matters: coronavirus transmission explained. #inners,1.2542640984450458e+18,0.0,['inners'],: Why wearing a mask matters: coronavirus transmission explained.,"[':', 'whi', 'wear', 'mask', 'matter', ':', 'coronaviru', 'transmiss', 'explain']"
212,212,212,212,2020-04-26 04:20:46,48986.0,363.0,en,United States,0.0,Hollyhappymom,"@JoeySalads @DineshDSouza I do wonder that myself. A Dr. who works at Northside hospital in GA told my sis. the hospital has very few cases of Covid, they’re preparing for elective surgeries sometime next week. And no, they have plenty of med supplies, they’re not wear one mask all day long.",1.2542641296045302e+18,0.0,[],"I do wonder that myself. A Dr. who works at Northside hospital in GA told my sis. the hospital has very few cases of Covid, theyre preparing for elective surgeries sometime next week. And no, they have plenty of med supplies, theyre not wear one mask all day long.","['wonder', 'A', 'dr.', 'work', 'northsid', 'hospit', 'GA', 'told', 'si', 'hospit', 'case', 'covid', 'theyr', 'prepar', 'elect', 'surgeri', 'sometim', 'next', 'week', 'and', 'plenti', 'med', 'suppli', 'theyr', 'wear', 'one', 'mask', 'day', 'long']"
213,213,213,213,2020-04-26 04:22:32,283871.0,10892.0,en,"Collierville,TN",0.0,_YvonneBurton,"""Wearing a mask is more for people already showing symptoms of coronavirus and their caregivers than for people trying to prevent it""",1.2542645760042394e+18,0.0,[],"""Wearing a mask is more for people already showing symptoms of coronavirus and their caregivers than for people trying to prevent it""","['``', 'wear', 'mask', 'peopl', 'alreadi', 'show', 'symptom', 'coronaviru', 'caregiv', 'peopl', 'tri', 'prevent', ""''""]"
214,214,214,214,2020-04-26 04:22:53,1366.0,513.0,en,"San Jose, California",2.0,KO6YQ,Afternoon project... I've been alternating between 2 N95 masks that I got for #cycling in 2018 fire season smoke. Rubber band straps broke. I used supplies I had from repairing a hat to fix them. #COVID19 #pandemic #BayArea #ShelterInPlace Day 40 #California #StayAtHome Day 37,1.2542646635225047e+18,0.0,"['cycling', 'COVID19', 'pandemic', 'BayArea', 'ShelterInPlace', 'California', 'StayAtHome']",Afternoon project... I've been alternating between N95 masks that I got for in fire season smoke. Rubber band straps broke. I used supplies I had from repairing a hat to fix them. Day Day,"['afternoon', 'project', '...', ""'ve"", 'altern', 'n95', 'mask', 'got', 'fire', 'season', 'smoke', 'rubber', 'band', 'strap', 'broke', 'use', 'suppli', 'repair', 'hat', 'fix', 'day', 'day']"
215,215,215,215,2020-04-26 04:24:17,4981.0,224.0,en,"El Paso, TX",0.0,stephnitaa,"DONT FUCKING YELL AT THE PEOPLE STILL WILLING AND NEEDING TO WORK. And wear your mask, just because Coronavirus is here doesn’t mean that sneezing stopped being a thing.",1.2542650172240036e+18,0.0,[],"DONT FUCKING YELL AT THE PEOPLE STILL WILLING AND NEEDING TO WORK. And wear your mask, just because Coronavirus is here doesnt mean that sneezing stopped being a thing.","['dont', 'fuck', 'yell', 'AT', 'the', 'peopl', 'still', 'will', 'and', 'need', 'TO', 'work', 'and', 'wear', 'mask', 'coronaviru', 'doesnt', 'mean', 'sneez', 'stop', 'thing']"
216,216,216,216,2020-04-26 04:25:22,16236.0,70.0,en,"Houston, TX",11.0,JaimeORJimmy,"RT @abc13houston: New York retailer charged with hoarding, gouging nearly 6 tons of masks, gowns, hand sanitizer amid coronavirus crisis ht…",1.254265286422868e+18,0.0,[],": New York retailer charged with hoarding, gouging nearly tons of masks, gowns, hand sanitizer amid coronavirus crisis ht","[':', 'new', 'york', 'retail', 'charg', 'hoard', 'goug', 'nearli', 'ton', 'mask', 'gown', 'hand', 'sanit', 'amid', 'coronaviru', 'crisi', 'ht']"
217,217,217,217,2020-04-26 04:26:22,21322.0,23610.0,en,USA,4.0,willmann12,"Common sense is dying in America. Are there really people this stupid out there? NJ police say 'excessive wearing' of coronavirus mask contributed to driver passing out, crashing car",1.2542655384879923e+18,0.0,[],"Common sense is dying in America. Are there really people this stupid out there? NJ police say 'excessive wearing' of coronavirus mask contributed to driver passing out, crashing car","['common', 'sens', 'die', 'america', 'are', 'realli', 'peopl', 'stupid', 'NJ', 'polic', 'say', ""'excess"", 'wear', 'coronaviru', 'mask', 'contribut', 'driver', 'pass', 'crash', 'car']"
218,218,218,218,2020-04-26 04:27:11,0.0,74923.0,en,In Your Mind Now,1.0,TomthunkitsMind,This might help you one of these days when the world runs out of face masks. #COVID2019 coronavirus via pokandiman #VoteBlueNoMatterWho,1.2542657464247624e+18,0.0,"['COVID2019', 'VoteBlueNoMatterWho']",This might help you one of these days when the world runs out of face masks. coronavirus via pokandiman,"['thi', 'might', 'help', 'one', 'day', 'world', 'run', 'face', 'mask', 'coronaviru', 'via', 'pokandiman']"
219,219,219,219,2020-04-26 04:27:44,287.0,671.0,en,West Coast,14.0,goodcontrarian,"RT @Oregonian: Roseburg VA director leads coronavirus dance party without social distancing, face masks",1.25426588566297e+18,0.0,[],": Roseburg VA director leads coronavirus dance party without social distancing, face masks","[':', 'roseburg', 'VA', 'director', 'lead', 'coronaviru', 'danc', 'parti', 'without', 'social', 'distanc', 'face', 'mask']"
220,220,220,220,2020-04-17 21:30:00,609.0,238169.0,en,"Manhattan, NY",7.0,CBSSunday,"What will the ""new normal"" look like? Do I still have to wear a mask? Doctor answers your coronavirus questions",1.2512616561827676e+18,1.0,[],"What will the ""new normal"" look like? Do I still have to wear a mask? Doctor answers your coronavirus questions","['what', '``', 'new', 'normal', ""''"", 'look', 'like', 'Do', 'still', 'wear', 'mask', 'doctor', 'answer', 'coronaviru', 'question']"
221,221,221,221,2020-04-17 21:32:48,1489.0,3412.0,en,Yonkers NY,0.0,yonkersoem40,"Cops: Stop dumping gloves, masks on street; they're #COVID19 hazards",1.2512623615976202e+18,0.0,['COVID19'],"Cops: Stop dumping gloves, masks on street; they're hazards","['cop', ':', 'stop', 'dump', 'glove', 'mask', 'street', ""'re"", 'hazard']"
222,222,222,222,2020-04-17 21:32:54,7223.0,126.0,en,,9.0,DarthBud,"RT @LasVegasLocally: @DarthBud @VitalVegas Shout-out to the ""COVID is a lie"" guy wearing an anti-COVID mask 😂",1.251262385425281e+18,0.0,[],": Shout-out to the ""COVID is a lie"" guy wearing an anti-COVID mask","[':', 'shout-out', '``', 'covid', 'lie', ""''"", 'guy', 'wear', 'anti-covid', 'mask']"
223,223,223,223,2020-04-17 21:33:30,88098.0,933.0,en,Miami,3.0,save_nasty,RT @lexxa_077: All you guys buying these “cool looking” mask and they might not even be made correctly 😂 breathing in the whole covid lol,1.2512625377080566e+18,0.0,[],: All you guys buying these cool looking mask and they might not even be made correctly breathing in the whole covid lol,"[':', 'all', 'guy', 'buy', 'cool', 'look', 'mask', 'might', 'even', 'made', 'correctli', 'breath', 'whole', 'covid', 'lol']"
224,224,224,224,2020-04-17 21:33:55,538.0,75.0,en,"South Carolina, USA",23183.0,JTPeterson1818,"RT @CBSNews: In tears, a nurse says she quit her job after she was asked to work in a coronavirus ICU without a face mask: “America is not…",1.25126264240205e+18,0.0,[],": In tears, a nurse says she quit her job after she was asked to work in a coronavirus ICU without a face mask: America is not","[':', 'In', 'tear', 'nurs', 'say', 'quit', 'job', 'ask', 'work', 'coronaviru', 'icu', 'without', 'face', 'mask', ':', 'america']"
225,225,225,225,2020-04-17 21:36:31,20245.0,12728.0,en,"New York, New York",0.0,DoctorJanette,@small1988 @HeyTammyBruce @TeamCavuto @FoxNews Any mask would help although the N95 better. Best to take precautions. Should wear the N95 around suspected covid pts,1.2512632965583217e+18,1.0,[],Any mask would help although the N95 better. Best to take precautions. Should wear the N95 around suspected covid pts,"['ani', 'mask', 'would', 'help', 'although', 'n95', 'better', 'best', 'take', 'precaut', 'should', 'wear', 'n95', 'around', 'suspect', 'covid', 'pt']"
226,226,226,226,2020-04-17 21:37:09,74332.0,1012.0,en,Seattle WA,0.0,Godscrillla,"""Coronavirus: Which mask should you wear?""",1.2512634550776013e+18,0.0,[],"""Coronavirus: Which mask should you wear?""","['``', 'coronaviru', ':', 'which', 'mask', 'wear', ""''""]"
227,227,227,227,2020-04-17 21:37:44,19765.0,1334.0,en,"Washington, DC",0.0,Fromgirltogirl,"MANDATORY: Starting 7am Saturday, the State of #Maryland requires everyone to wear a mask 😷 when they go outside. This is mandatory! #md #coronavirus #covid19 #covid #stayhome #stayhomestaysafe #dmv",1.2512636021342618e+18,0.0,"['Maryland', 'md', 'coronavirus', 'covid19', 'covid', 'stayhome', 'stayhomestaysafe', 'dmv']","MANDATORY: Starting am Saturday, the State of requires everyone to wear a mask when they go outside. This is mandatory!","['mandatori', ':', 'start', 'saturday', 'state', 'requir', 'everyon', 'wear', 'mask', 'go', 'outsid', 'thi', 'mandatori', '!']"
228,228,228,228,2020-04-17 21:37:39,1133.0,9.0,en,"Staten Island, NY",2.0,Rosemariehanlo3,RT @NattyDred101: @An0nAKn0wledge These people don’t have Covid- there’s a worker wearing no mask!!!!,1.251263580974039e+18,0.0,[],: These people dont have Covid- theres a worker wearing no mask!!!!,"[':', 'these', 'peopl', 'dont', 'covid-', 'there', 'worker', 'wear', 'mask', '!', '!', '!', '!']"
