,Unnamed: 0,Unnamed: 0.1,Unnamed: 0.1.1,date,favourites_count,followers_count,language,location,retweet_count,screen_name,tweet,tweet_id,verified,hashtags,clean_tweet,processed_tweet
368,368,368,368,2020-04-08 10:29:33,369.0,134.0,en,"Tenafly, NJ",0.0,heitn001,"@DrJCheungEP Very unfortunate that HCW in NYC were also required to see COVID + pts w/o N95 masks. We lost a lot of staff to the virus, have to imagine that this was a contributing factor",1.2478339579636122e+18,0.0,[],"Very unfortunate that HCW in NYC were also required to see COVID + pts w/o N95 masks. We lost a lot of staff to the virus, have to imagine that this was a contributing factor","['veri', 'unfortun', 'hcw', 'nyc', 'also', 'requir', 'see', 'covid', '+', 'pt', 'w/o', 'n95', 'mask', 'We', 'lost', 'lot', 'staff', 'viru', 'imagin', 'contribut', 'factor']"
369,369,369,369,2020-04-08 10:29:55,7103.0,778.0,en,Phila Pa,23184.0,jeaniedoc,"RT @CBSNews: In tears, a nurse says she quit her job after she was asked to work in a coronavirus ICU without a face mask: “America is not…",1.247834049441403e+18,0.0,[],": In tears, a nurse says she quit her job after she was asked to work in a coronavirus ICU without a face mask: America is not","[':', 'In', 'tear', 'nurs', 'say', 'quit', 'job', 'ask', 'work', 'coronaviru', 'icu', 'without', 'face', 'mask', ':', 'america']"
370,370,370,370,2020-04-08 10:31:58,270.0,922.0,en,"Bangor, Co Down",0.0,BMHockeyClub,"@naked_hockey have sourced some PPE equipment. Each mask** costs approx £3* &amp; every mask you purchase will go straight to a hospital, nursing home or COVID Centre. If you would like to donate a larger amount please just email team@nkdhockey.com. 👇👇👇",1.2478345662383557e+18,0.0,[],"have sourced some PPE equipment. Each mask** costs approx * &amp; every mask you purchase will go straight to a hospital, nursing home or COVID Centre. If you would like to donate a larger amount please just email team.com.","['sourc', 'ppe', 'equip', 'each', 'mask', '*', '*', 'cost', 'approx', '*', '&', 'amp', 'everi', 'mask', 'purchas', 'go', 'straight', 'hospit', 'nurs', 'home', 'covid', 'centr', 'If', 'would', 'like', 'donat', 'larger', 'amount', 'pleas', 'email', 'team.com']"
371,371,371,371,2020-04-08 10:32:21,19007.0,70.0,en,"Albany, NY",13.0,rmaxdean,RT @annimaniac: Friend says this happened at their hospital in the Bay Area: Hospitals say feds are seizing masks and other coronavirus sup…,1.2478346627409388e+18,0.0,[],: Friend says this happened at their hospital in the Bay Area: Hospitals say feds are seizing masks and other coronavirus sup,"[':', 'friend', 'say', 'happen', 'hospit', 'bay', 'area', ':', 'hospit', 'say', 'fed', 'seiz', 'mask', 'coronaviru', 'sup']"
372,372,372,372,2020-04-04 15:14:01,24554.0,26171.0,en,"San Francisco, CA",1.0,atulbutte,"@balajis Been thinking about this: #COVID19 is essentially an invisible disease for most people. The ONLY way folks even know it exists is through media: hospital videos, statistical curves. Otherwise, folks only see empty shelves, masks, unemployment &amp; lockdowns. Lot of trust needed.",1.24645599421483e+18,1.0,['COVID19'],"Been thinking about this: is essentially an invisible disease for most people. The ONLY way folks even know it exists is through media: hospital videos, statistical curves. Otherwise, folks only see empty shelves, masks, unemployment &amp; lockdowns. Lot of trust needed.","['been', 'think', ':', 'essenti', 'invis', 'diseas', 'peopl', 'the', 'onli', 'way', 'folk', 'even', 'know', 'exist', 'media', ':', 'hospit', 'video', 'statist', 'curv', 'otherwis', 'folk', 'see', 'empti', 'shelv', 'mask', 'unemploy', '&', 'amp', 'lockdown', 'lot', 'trust', 'need']"
373,373,373,373,2020-04-04 15:14:26,7146.0,140.0,en,Montana,11872.0,jl4rider,RT @FLOTUS: As the weekend approaches I ask that everyone take social distancing &amp; wearing a mask/face covering seriously. #COVID19 is a vi…,1.2464560990977556e+18,0.0,['COVID19'],: As the weekend approaches I ask that everyone take social distancing &amp; wearing a mask/face covering seriously. is a vi,"[':', 'As', 'weekend', 'approach', 'ask', 'everyon', 'take', 'social', 'distanc', '&', 'amp', 'wear', 'mask/fac', 'cover', 'serious', 'vi']"
374,374,374,374,2020-04-04 15:14:23,10834.0,3872.0,en,"Cincinnati, Oh U.S.A",0.0,TheCharlieKruse,Coronavirus: US accused of hijacking shipments of masks | DW News via @YouTube,1.2464560864937902e+18,0.0,[],Coronavirus: US accused of hijacking shipments of masks | DW News via,"['coronaviru', ':', 'US', 'accus', 'hijack', 'shipment', 'mask', '|', 'DW', 'new', 'via']"
375,375,375,375,2020-04-04 15:14:43,1409.0,11.0,en,United States,0.0,drstephenip,Scientists Probe How Coronavirus Might Travel Through The Air : 6 ft is not enough !! Must wear masks !!!,1.2464561701744517e+18,0.0,[],Scientists Probe How Coronavirus Might Travel Through The Air : ft is not enough !! Must wear masks !!!,"['scientist', 'probe', 'how', 'coronaviru', 'might', 'travel', 'through', 'the', 'air', ':', 'ft', 'enough', '!', '!', 'must', 'wear', 'mask', '!', '!', '!']"
376,376,376,376,2020-04-04 15:16:36,93324.0,2066.0,en,Land of Enchantment,3.0,JudyBott,"RT @kentbrew: ""Blue Flame Medical LLC, was formed Monday. It sells coronavirus testing kits, N95 respirator masks, “a wide selection” of pe…",1.246456644717785e+18,0.0,[],": ""Blue Flame Medical LLC, was formed Monday. It sells coronavirus testing kits, N95 respirator masks, a wide selection of pe","[':', '``', 'blue', 'flame', 'medic', 'llc', 'form', 'monday', 'It', 'sell', 'coronaviru', 'test', 'kit', 'n95', 'respir', 'mask', 'wide', 'select', 'pe']"
377,377,377,377,2020-04-04 15:16:58,25284.0,3578.0,en,Florida,10.0,ferdalump,"Lane lost a tooth yesterday, and was a little worried the Tooth Fairy might not be able to safely visit amidst the Coronavirus. Turns out she’s quite a clever &amp; safety conscious fairy. Look at the little mask we found left behind on her tiny doorstep! 🧚🏻‍♀️😷🦷✨",1.2464567357134277e+18,0.0,[],"Lane lost a tooth yesterday, and was a little worried the Tooth Fairy might not be able to safely visit amidst the Coronavirus. Turns out shes quite a clever &amp; safety conscious fairy. Look at the little mask we found left behind on her tiny doorstep!","['lane', 'lost', 'tooth', 'yesterday', 'littl', 'worri', 'tooth', 'fairi', 'might', 'abl', 'safe', 'visit', 'amidst', 'coronaviru', 'turn', 'she', 'quit', 'clever', '&', 'amp', 'safeti', 'consciou', 'fairi', 'look', 'littl', 'mask', 'found', 'left', 'behind', 'tini', 'doorstep', '!']"
378,378,378,378,2020-04-04 15:16:51,28552.0,30960.0,en,"Chicago, IL",2840.0,danielzliu,RT @EricTopol: The debate and confusion about masks for #COVID19 just got some real and important data from a rigorous randomized trial in…,1.2464567073808876e+18,0.0,['COVID19'],: The debate and confusion about masks for just got some real and important data from a rigorous randomized trial in,"[':', 'the', 'debat', 'confus', 'mask', 'got', 'real', 'import', 'data', 'rigor', 'random', 'trial']"
379,379,379,379,2020-04-04 15:17:30,99805.0,8421.0,en,"California, USA",78.0,EllieAzadi,RT @IranHrm: An #Iranian healthcare say that they have been given counterfeit N95 masks instead of standard masks amid the #coronavirus pan…,1.246456871235375e+18,0.0,"['Iranian', 'coronavirus']",: An healthcare say that they have been given counterfeit N95 masks instead of standard masks amid the pan,"[':', 'An', 'healthcar', 'say', 'given', 'counterfeit', 'n95', 'mask', 'instead', 'standard', 'mask', 'amid', 'pan']"
380,380,380,380,2020-04-04 15:17:23,3356.0,434.0,en,"California, USA",1.0,SumnerLN,Surgical masks are effective. Debilitated patients benefit from transfusions of survivors’ blood. And more. Great summary of recent papers from @nature #COVID19 #coronavirus,1.246456841342554e+18,0.0,"['COVID19', 'coronavirus']",Surgical masks are effective. Debilitated patients benefit from transfusions of survivors blood. And more. Great summary of recent papers from,"['surgic', 'mask', 'effect', 'debilit', 'patient', 'benefit', 'transfus', 'survivor', 'blood', 'and', 'great', 'summari', 'recent', 'paper']"
381,381,381,381,2020-04-04 15:17:27,56909.0,1633.0,en,Norwalk CA.,9.0,GIRsdoomsong,"RT @jilevin: An interview with the CDC director on coronavirus, masks, and an agency gone quiet",1.2464568582834094e+18,0.0,[],": An interview with the CDC director on coronavirus, masks, and an agency gone quiet","[':', 'An', 'interview', 'cdc', 'director', 'coronaviru', 'mask', 'agenc', 'gone', 'quiet']"
382,382,382,382,2020-04-04 15:18:18,7251.0,21483.0,en,"Dallas, TX",0.0,RickSmith,"Shopping at @costco in the age of COVID-19. Costco is limiting the number of people in the store, and lots and lots of masks. This is SUREAL. #COVID #Covid19 #costco",1.246457071933051e+18,0.0,"['COVID', 'Covid19', 'costco']","Shopping at in the age of COVID-19. Costco is limiting the number of people in the store, and lots and lots of masks. This is SUREAL.","['shop', 'age', 'covid-19', 'costco', 'limit', 'number', 'peopl', 'store', 'lot', 'lot', 'mask', 'thi', 'sureal']"
383,383,383,383,2020-04-04 15:18:44,304.0,18.0,en,"Wilsonville, OR",1.0,jholl65,"Arizona Border Wall Work Ignites Coronavirus Fears - The New York Times. Would the funds be better spent on medical supplies: ventilators, masks, protective clothing?",1.2464571808756572e+18,0.0,[],"Arizona Border Wall Work Ignites Coronavirus Fears - The New York Times. Would the funds be better spent on medical supplies: ventilators, masks, protective clothing?","['arizona', 'border', 'wall', 'work', 'ignit', 'coronaviru', 'fear', '-', 'the', 'new', 'york', 'time', 'would', 'fund', 'better', 'spent', 'medic', 'suppli', ':', 'ventil', 'mask', 'protect', 'cloth']"
384,384,384,384,2020-04-04 15:18:35,127.0,128.0,en,"Palm Beach Gardens, FL",0.0,palmbeachbrain,You asked... we delivered. Corona Cover has added matching masks. Preorder now at a discount. #getyourgloveandmaskon #covid #covidkindness #staysafe,1.246457143462703e+18,0.0,"['getyourgloveandmaskon', 'covid', 'covidkindness', 'staysafe']",You asked... we delivered. Corona Cover has added matching masks. Preorder now at a discount.,"['you', 'ask', '...', 'deliv', 'corona', 'cover', 'ad', 'match', 'mask', 'preorder', 'discount']"
385,385,385,385,2020-04-04 15:19:00,1483.0,3614.0,en,"destin, fl",144.0,toddglobalteam,"RT @mercola: Wearing masks could be a key strategy to reduce the spread of novel coronavirus 2019 (COVID-19), stop lockdowns, get the econo…",1.2464572484208927e+18,0.0,[],": Wearing masks could be a key strategy to reduce the spread of novel coronavirus (COVID-19), stop lockdowns, get the econo","[':', 'wear', 'mask', 'could', 'key', 'strategi', 'reduc', 'spread', 'novel', 'coronaviru', 'covid-19', 'stop', 'lockdown', 'get', 'econo']"
386,386,386,386,2020-04-04 15:19:04,4518.0,166195.0,en,"Fresno, CA",3.0,ABC30,How can Americans prepare for an outbreak? Is it time to buy face masks? Here's everything you need to know about the new coronavirus.,1.246457264770298e+18,1.0,[],How can Americans prepare for an outbreak? Is it time to buy face masks? Here's everything you need to know about the new coronavirus.,"['how', 'american', 'prepar', 'outbreak', 'Is', 'time', 'buy', 'face', 'mask', 'here', ""'s"", 'everyth', 'need', 'know', 'new', 'coronaviru']"
387,387,387,387,2020-04-04 15:19:27,1133.0,182.0,en,"Sandy Springs, GA",0.0,DrewEvangelista,"For shame @MinnCorrections @GovTimWalz! Known COVID in the prisons and testing inmates but not allowing testing of corrections officers even if they have symptoms. Not allowing masks as to not ""scare"" the prisoners. Brother-In-Law risking his life and getting short-changed. @CNN",1.2464573613903217e+18,0.0,[],"For shame ! Known COVID in the prisons and testing inmates but not allowing testing of corrections officers even if they have symptoms. Not allowing masks as to not ""scare"" the prisoners. Brother-In-Law risking his life and getting short-changed.","['for', 'shame', '!', 'known', 'covid', 'prison', 'test', 'inmat', 'allow', 'test', 'correct', 'offic', 'even', 'symptom', 'not', 'allow', 'mask', '``', 'scare', ""''"", 'prison', 'brother-in-law', 'risk', 'life', 'get', 'short-chang']"
388,388,388,388,2020-04-04 15:21:28,13084.0,6582.0,en,Denver,0.0,RamonaEid,WH trade adviser slams 3M for 'acting like a sovereign nation': 'Stop whining' and make masks for Americans #FoxNews #COVID19 #CornaVirus #CoronaVirusUpdate #MostPlainSpokenManInGovernment,1.2464578689008968e+18,0.0,"['FoxNews', 'COVID19', 'CornaVirus', 'CoronaVirusUpdate', 'MostPlainSpokenManInGovernment']",WH trade adviser slams M for 'acting like a sovereign nation': 'Stop whining' and make masks for Americans,"['WH', 'trade', 'advis', 'slam', 'M', ""'act"", 'like', 'sovereign', 'nation', ':', ""'stop"", 'whine', 'make', 'mask', 'american']"
389,389,389,389,2020-04-04 15:22:30,195.0,583.0,en,USA,0.0,LarryStCroix,"1. The CDC recommends all Americans wear simple “non-medical, cloth” masks in public to help protect others from virus droplets that pre-symptomatic and non-symptomatic #coronavirus victims spread",1.2464581293168927e+18,0.0,['coronavirus'],". The CDC recommends all Americans wear simple non-medical, cloth masks in public to help protect others from virus droplets that pre-symptomatic and non-symptomatic victims spread","['the', 'cdc', 'recommend', 'american', 'wear', 'simpl', 'non-med', 'cloth', 'mask', 'public', 'help', 'protect', 'other', 'viru', 'droplet', 'pre-symptomat', 'non-symptomat', 'victim', 'spread']"
390,390,390,390,2020-04-04 15:23:32,1832.0,94269.0,en,"Colorado Springs, CO",2.0,KKTV11News,What to know about the coronavirus in Colorado on Friday: Governor asks everyone to wear non-medical masks when they go out,1.2464583890449777e+18,1.0,[],What to know about the coronavirus in Colorado on Friday: Governor asks everyone to wear non-medical masks when they go out,"['what', 'know', 'coronaviru', 'colorado', 'friday', ':', 'governor', 'ask', 'everyon', 'wear', 'non-med', 'mask', 'go']"
391,391,391,391,2020-04-04 15:23:26,146104.0,22484.0,en,New Germany,141.0,jimdwrench,"RT @Wyn1745: White House #COVID19 Task Force, Dr. Fauci recommends people wear cloth masks in public. *If the #COVID survives in the air fo…",1.2464583642777846e+18,0.0,"['COVID19', 'COVID']",": White House Task Force, Dr. Fauci recommends people wear cloth masks in public. *If the survives in the air fo","[':', 'white', 'hous', 'task', 'forc', 'dr.', 'fauci', 'recommend', 'peopl', 'wear', 'cloth', 'mask', 'public', '*', 'If', 'surviv', 'air', 'fo']"
392,392,392,392,2020-04-04 15:23:56,4585.0,595.0,en,"Chapel Hill, NC",0.0,TrippTuttle,"I just ordered a couple baclavas and gonna make a few others for myself today. — To help stop coronavirus, everyone should be wearing face masks. The science is clear.",1.2464584897083474e+18,0.0,[],"I just ordered a couple baclavas and gonna make a few others for myself today. To help stop coronavirus, everyone should be wearing face masks. The science is clear.","['order', 'coupl', 'baclava', 'gon', 'na', 'make', 'other', 'today', 'To', 'help', 'stop', 'coronaviru', 'everyon', 'wear', 'face', 'mask', 'the', 'scienc', 'clear']"
393,393,393,393,2020-04-04 15:24:29,6946.0,42262.0,en,California,20.0,BCstrat,RT @evankirstel: Anyone can make Tora Smart's DIY no-sew face mask / Boing Boing @IrmaRaste @eViRaHealth #COVID19 #…,1.246458628275667e+18,0.0,['COVID19'],: Anyone can make Tora Smart's DIY no-sew face mask / Boing Boing,"[':', 'anyon', 'make', 'tora', 'smart', ""'s"", 'diy', 'no-sew', 'face', 'mask', '/', 'bo', 'bo']"
394,394,394,394,2020-04-04 15:24:58,335681.0,435.0,en,Denver CO,24.0,sww1235,RT @mfoxhunter: With #COVID19 there is this article that shows wearing a mask helped. “They said the study proves the importance of washin…,1.246458750090629e+18,0.0,['COVID19'],: With there is this article that shows wearing a mask helped. They said the study proves the importance of washin,"[':', 'with', 'articl', 'show', 'wear', 'mask', 'help', 'they', 'said', 'studi', 'prove', 'import', 'washin']"
395,395,395,395,2020-04-04 15:25:06,49.0,233.0,en,"New York, NY",0.0,jpafhc,When and how to wear medical masks to protect against coronavirus,1.2464587839724462e+18,0.0,[],When and how to wear medical masks to protect against coronavirus,"['when', 'wear', 'medic', 'mask', 'protect', 'coronaviru']"
396,396,396,396,2020-04-04 15:26:52,1133.0,182.0,en,"Sandy Springs, GA",0.0,DrewEvangelista,"@MinnCorrections With known COVID in prisons like Moose Lake why are you testing inmates but not testing corrections officers even if they have symptoms? On top of not having allowed masks to not ""scare"" the prisoners. Brother-In-Law risking his life and getting short-changed.",1.2464592281827942e+18,0.0,[],"With known COVID in prisons like Moose Lake why are you testing inmates but not testing corrections officers even if they have symptoms? On top of not having allowed masks to not ""scare"" the prisoners. Brother-In-Law risking his life and getting short-changed.","['with', 'known', 'covid', 'prison', 'like', 'moos', 'lake', 'test', 'inmat', 'test', 'correct', 'offic', 'even', 'symptom', 'On', 'top', 'allow', 'mask', '``', 'scare', ""''"", 'prison', 'brother-in-law', 'risk', 'life', 'get', 'short-chang']"
397,397,397,397,2020-04-04 15:27:30,20244.0,286.0,en,Philly ,40.0,Bedardd26,RT @CBSPhilly: #BREAKING: Pennsylvania Gov. Tom Wolf asking all residents to wear masks while out in public as #coronavirus cases climb abo…,1.2464593879898972e+18,0.0,"['BREAKING', 'coronavirus']",: : Pennsylvania Gov. Tom Wolf asking all residents to wear masks while out in public as cases climb abo,"[':', ':', 'pennsylvania', 'gov', 'tom', 'wolf', 'ask', 'resid', 'wear', 'mask', 'public', 'case', 'climb', 'abo']"
398,398,398,398,2020-04-04 15:27:37,88437.0,393.0,en,Kentucky,9.0,phatnutz5,RT @youarethegears: the mask &amp; the glove kill me. i haven’t wanted a tshirt this bad for years... #metal #pantera #covid19 #donate,1.2464594168677253e+18,0.0,"['metal', 'pantera', 'covid19', 'donate']",: the mask &amp; the glove kill me. i havent wanted a tshirt this bad for years...,"[':', 'mask', '&', 'amp', 'glove', 'kill', 'havent', 'want', 'tshirt', 'bad', 'year', '...']"
399,399,399,399,2020-04-04 15:28:48,76518.0,279.0,en,United States,32.0,nocovfefe,RT @AltSpaceForce1: Text MASKS to 50409 today to download mask patterns or volunteer. Powered by @resistbot #COVID19,1.2464597145458893e+18,0.0,['COVID19'],: Text MASKS to today to download mask patterns or volunteer. Powered by,"[':', 'text', 'mask', 'today', 'download', 'mask', 'pattern', 'volunt', 'power']"
400,400,400,400,2020-04-04 15:29:33,4935.0,628.0,en,"Baltimore, MD",118.0,50shadesofkhey,RT @MissElise84: Here’s a pretty simple video on how to make your own face mask at home! #COVID19,1.2464599034446848e+18,0.0,['COVID19'],: Heres a pretty simple video on how to make your own face mask at home!,"[':', 'here', 'pretti', 'simpl', 'video', 'make', 'face', 'mask', 'home', '!']"
401,401,401,401,2020-04-04 15:29:28,146673.0,8878.0,en,"Highlands, TX",34.0,VrouwvdVrijheid,RT @VrouwvdVrijheid: #coronavirus Part 1. 20mins spread of respiratory droplets. Is important to a wear mask as #covid19 is finally certi…,1.2464598822005883e+18,0.0,"['coronavirus', 'covid19']",: Part . mins spread of respiratory droplets. Is important to a wear mask as is finally certi,"[':', 'part', 'min', 'spread', 'respiratori', 'droplet', 'Is', 'import', 'wear', 'mask', 'final', 'certi']"
402,402,402,402,2020-04-04 15:29:40,36869.0,1145.0,en,"New Jersey, USA",0.0,cristinagargoyL,"We could have been wearing masks, for what they're worth, for WEEKS now. But no, because Trump was worried about the ""optics"" of him having to admit he was wrong in his initial dismissal of COVID. We should all be furious. Now we have this half-ass bandana tutorial.",1.2464599327335547e+18,0.0,[],"We could have been wearing masks, for what they're worth, for WEEKS now. But no, because Trump was worried about the ""optics"" of him having to admit he was wrong in his initial dismissal of COVID. We should all be furious. Now we have this half-ass bandana tutorial.","['We', 'could', 'wear', 'mask', ""'re"", 'worth', 'week', 'but', 'trump', 'worri', '``', 'optic', ""''"", 'admit', 'wrong', 'initi', 'dismiss', 'covid', 'We', 'furiou', 'now', 'half-ass', 'bandana', 'tutori']"
403,403,403,403,2020-04-04 15:30:04,1.0,0.0,en,Albuquerque NM,0.0,AchievementGal1,GRATEFUL!!!! We have masks if you need them ! Call or email ! #promotionalproducts #albuquerque #covid19,1.2464600332836127e+18,0.0,"['promotionalproducts', 'albuquerque', 'covid19']",GRATEFUL!!!! We have masks if you need them ! Call or email !,"['grate', '!', '!', '!', '!', 'We', 'mask', 'need', '!', 'call', 'email', '!']"
404,404,404,404,2020-04-04 15:30:10,53674.0,2304.0,en,"Washington, DC",5.0,LynnOvermann,"If you're like me &amp; trying to find ways to help fight #COVID19 (&amp; also feel less helpless) let's flood our frontline workers with team masks. It's been a joy matching fabric-&gt;sewers-&gt;hospitals. If you want to do the same, check out @MaskMatch. #allcaps @NHL @NBA @MLB @NFL",1.246460058373886e+18,0.0,"['COVID19', 'allcaps']","If you're like me &amp; trying to find ways to help fight (&amp; also feel less helpless) let's flood our frontline workers with team masks. It's been a joy matching fabric-&gtewers-&gt;hospitals. If you want to do the same, check out .","['If', ""'re"", 'like', '&', 'amp', 'tri', 'find', 'way', 'help', 'fight', '&', 'amp', 'also', 'feel', 'less', 'helpless', 'let', ""'s"", 'flood', 'frontlin', 'worker', 'team', 'mask', 'It', ""'s"", 'joy', 'match', 'fabric-', '&', 'gtewers-', '&', 'gt', 'hospit', 'If', 'want', 'check']"
405,405,405,405,2020-04-04 15:30:15,26143.0,11390.0,en,"Wisconsin, USA",8.0,TheWoodzick,RT @16mks16: Use your scarf as a mask . . . #Colorado #coronavirus #COVID2019 #COVIDー19 #Denver #StayHome #weekend #coloradomaskproject #Co…,1.2464600796766085e+18,0.0,"['Colorado', 'coronavirus', 'COVID2019', 'COVIDー19', 'Denver', 'StayHome', 'weekend', 'coloradomaskproject', 'Co']",: Use your scarf as a mask . . .,"[':', 'use', 'scarf', 'mask']"
406,406,406,406,2020-04-04 15:31:02,1061.0,2336.0,en,"Harrisburg, PA",49.0,PALegBlkCaucus,"RT @PAHealthDept: STAYING HOME is the best way to protect yourself + others against #COVID19. If you must leave the house, a mask could b…",1.2464602763896136e+18,1.0,['COVID19'],": STAYING HOME is the best way to protect yourself + others against . If you must leave the house, a mask could b","[':', 'stay', 'home', 'best', 'way', 'protect', '+', 'other', 'If', 'must', 'leav', 'hous', 'mask', 'could', 'b']"
407,407,407,407,2020-04-04 15:31:21,1184.0,788.0,en,"Buffalo, NY",30.0,ReEnergizeBflo,RT @adamzyglis: Our masked crusaders... @TheBuffaloNews #Doctors #Nurses #NursesAreHeroes #COVID19 #NYC #HealthcareHeroes,1.2464603565889044e+18,0.0,"['Doctors', 'Nurses', 'NursesAreHeroes', 'COVID19', 'NYC', 'HealthcareHeroes']",: Our masked crusaders...,"[':', 'our', 'mask', 'crusad', '...']"
408,408,408,408,2020-04-04 15:32:40,86595.0,1406.0,en,USA,0.0,KogerView,U.S. exported millions in masks and ventilators ahead of the coronavirus crisis via @usatoday,1.2464606873182126e+18,0.0,[],U.S. exported millions in masks and ventilators ahead of the coronavirus crisis via,"['u.s.', 'export', 'million', 'mask', 'ventil', 'ahead', 'coronaviru', 'crisi', 'via']"
409,409,409,409,2020-04-04 15:32:27,72235.0,2309.0,en,"Rogue River, Oregon #homebase",179.0,justiceputnam,"RT @zeynep: ""The president, whom nobody is allowed to approach without a COVID test, says he may choose not wear a mask."" See? Journalists…",1.2464606333037937e+18,0.0,[],": ""The president, whom nobody is allowed to approach without a COVID test, says he may choose not wear a mask."" See? Journalists","[':', '``', 'the', 'presid', 'nobodi', 'allow', 'approach', 'without', 'covid', 'test', 'say', 'may', 'choos', 'wear', 'mask', ""''"", 'see', 'journalist']"
410,410,410,410,2020-04-04 15:32:41,11286.0,904.0,en,"Pennsylvania, USA",1.0,macandtrouble,How to make masks at home ! #coronavirus #mask #cdc #who,1.2464606920913388e+18,0.0,"['coronavirus', 'mask', 'cdc', 'who']",How to make masks at home !,"['how', 'make', 'mask', 'home', '!']"
411,411,411,411,2020-04-04 15:32:53,7490.0,49.0,en,Washington DC,105.0,SaintEbbitt,RT @SkyNews: Donald Trump has urged Americans to wear face masks in public to help fight the spread of #coronavirus - but insisted he will…,1.246460741919613e+18,0.0,['coronavirus'],: Donald Trump has urged Americans to wear face masks in public to help fight the spread of - but insisted he will,"[':', 'donald', 'trump', 'urg', 'american', 'wear', 'face', 'mask', 'public', 'help', 'fight', 'spread', '-', 'insist']"
412,412,412,412,2020-04-04 15:33:50,85.0,44.0,en,"Green Bay, WI",0.0,nickolashummel,"This is because they have new data that shows a higher risk of transmission between those who are asymptomatic or presymptomatic, and don’t know they have coronavirus. The masks would help to contain the infectious droplets from getting into the air.",1.246460980894335e+18,0.0,[],"This is because they have new data that shows a higher risk of transmission between those who are asymptomatic or presymptomatic, and dont know they have coronavirus. The masks would help to contain the infectious droplets from getting into the air.","['thi', 'new', 'data', 'show', 'higher', 'risk', 'transmiss', 'asymptomat', 'presymptomat', 'dont', 'know', 'coronaviru', 'the', 'mask', 'would', 'help', 'contain', 'infecti', 'droplet', 'get', 'air']"
