,Unnamed: 0,Unnamed: 0.1,Unnamed: 0.1.1,date,favourites_count,followers_count,language,location,retweet_count,screen_name,tweet,tweet_id,verified,hashtags,clean_tweet,processed_tweet
499,499,499,499,2020-04-02 04:34:07,110095.0,1185.0,en,"New Jersey, USA",2097.0,PriscillaSpice,"RT @ProjectLincoln: 📺 As the consequences of #COVID19 tear across the country, American heroes everywhere are donning masks, scrubs, unifor…",1.245570183147774e+18,0.0,['COVID19'],": As the consequences of tear across the country, American heroes everywhere are donning masks, scrubs, unifor","[':', 'As', 'consequ', 'tear', 'across', 'countri', 'american', 'hero', 'everywher', 'don', 'mask', 'scrub', 'unifor']"
500,500,500,500,2020-04-02 04:34:43,4356.0,1274.0,en,Pacific Northwest,560.0,MessFixing,RT @DrMattMcCarthy: UPDATE: CDC's stance on masks is evolving because our understanding of #coronavirus has changed. Some believe we should…,1.2455703333246648e+18,0.0,['coronavirus'],: UPDATE: CDC's stance on masks is evolving because our understanding of has changed. Some believe we should,"[':', 'updat', ':', 'cdc', ""'s"", 'stanc', 'mask', 'evolv', 'understand', 'chang', 'some', 'believ']"
501,501,501,501,2020-04-02 04:34:57,4356.0,1274.0,en,Pacific Northwest,64.0,MessFixing,RT @DrMattMcCarthy: ...makes masks more important &amp; helps explain one of the most perplexing features of the virus: #Coronavirus is now pro…,1.2455703930682778e+18,0.0,['Coronavirus'],: ...makes masks more important &amp; helps explain one of the most perplexing features of the virus: is now pro,"[':', '...', 'make', 'mask', 'import', '&', 'amp', 'help', 'explain', 'one', 'perplex', 'featur', 'viru', ':', 'pro']"
502,502,502,502,2020-04-02 04:38:00,35921.0,132.0,en,🇹🇼TAIWAN (Taiwanese≠Chinese),7230.0,CatsPajamasOnTT,RT @vonderleyen: The European Union thanks Taiwan for its donation of 5.6 million masks to help fight the #coronavirus. We really appreciat…,1.2455711598457692e+18,0.0,['coronavirus'],: The European Union thanks Taiwan for its donation of million masks to help fight the . We really appreciat,"[':', 'the', 'european', 'union', 'thank', 'taiwan', 'donat', 'million', 'mask', 'help', 'fight', 'We', 'realli', 'appreciat']"
503,503,503,503,2020-04-02 04:39:58,258.0,698.0,en,"Novato, CA",0.0,CPLabSafety,What is the right mask for #COVID19 #safety #surgicalmasks #n95masks #kn95mask,1.2455716553944556e+18,0.0,"['COVID19', 'safety', 'surgicalmasks', 'n95masks', 'kn95mask']",What is the right mask for,"['what', 'right', 'mask']"
504,504,504,504,2020-04-02 04:39:52,1551.0,142271.0,en,Houston,68.0,McClain_on_NFL,"RT @TIME: ""This is truly a last resort."" Makers are 3D printing ventilator gear and sewing masks to fight the coronavirus",1.245571630505415e+18,1.0,[],": ""This is truly a last resort."" Makers are D printing ventilator gear and sewing masks to fight the coronavirus","[':', '``', 'thi', 'truli', 'last', 'resort', ""''"", 'maker', 'D', 'print', 'ventil', 'gear', 'sew', 'mask', 'fight', 'coronaviru']"
505,505,505,505,2020-04-02 04:41:28,3500.0,102.0,en,"Chicago, IL",0.0,AnthonyIsMunny,I don't have gloves or masks but I have a closet filled with ~150 plastic shopping bags. How can I help with covid-19? #COVID19 #gloves #covid4MDs,1.2455720327895409e+18,0.0,"['COVID19', 'gloves', 'covid4MDs']",I don't have gloves or masks but I have a closet filled with ~150 plastic shopping bags. How can I help with covid-19?,"[""n't"", 'glove', 'mask', 'closet', 'fill', '~150', 'plastic', 'shop', 'bag', 'how', 'help', 'covid-19']"
506,506,506,506,2020-04-02 04:43:55,240511.0,819.0,en,"USA,TX",411.0,MAGA_USMC,"RT @USNavy: #USNavy photos of the day: #USNSComfort practice with #n95 masks, #USNavy and #usairforce make meals #COVID19, #VP4 flies with…",1.2455726492934676e+18,0.0,"['USNavy', 'USNSComfort', 'n95', 'USNavy', 'usairforce', 'COVID19', 'VP4']",": photos of the day: practice with masks, and make meals , flies with","[':', 'photo', 'day', ':', 'practic', 'mask', 'make', 'meal', 'fli']"
507,507,507,507,2020-04-02 04:44:30,583.0,8.0,en,"Bronx, NY",10.0,ninja2156,"RT @ABC7NY: Disney Parks donates masks, ponchos to health care workers on the front line of coronavirus crisis http…",1.2455727953181532e+18,0.0,[],": Disney Parks donates masks, ponchos to health care workers on the front line of coronavirus crisis http","[':', 'disney', 'park', 'donat', 'mask', 'poncho', 'health', 'care', 'worker', 'front', 'line', 'coronaviru', 'crisi', 'http']"
508,508,508,508,2020-04-02 04:45:17,4327.0,430.0,en,"New Market, MD",630.0,Sustin41,RT @DEFCONWSALERTS: Russia is sending the United States medical supplies and masks to help fight the Coronavirus.,1.2455729929369969e+18,0.0,[],: Russia is sending the United States medical supplies and masks to help fight the Coronavirus.,"[':', 'russia', 'send', 'unit', 'state', 'medic', 'suppli', 'mask', 'help', 'fight', 'coronaviru']"
509,509,509,509,2020-04-02 04:45:49,59278.0,2882.0,en,USA,9.0,TLDRJones,RT @LittleNinjaUK: @SkyNews Question: Does wearing a mask in public slow the spread of #COVID19? Answer: Yes. Even a #homemademask can cap…,1.2455731274106143e+18,0.0,"['COVID19', 'homemademask']",: Question: Does wearing a mask in public slow the spread of ? Answer: Yes. Even a can cap,"[':', 'question', ':', 'doe', 'wear', 'mask', 'public', 'slow', 'spread', 'answer', ':', 'ye', 'even', 'cap']"
510,510,510,510,2020-04-02 04:47:51,1881.0,30121.0,en,New York City,12.0,govttrader,Just spoke to a doctor friend who works in large NYC Hospital doing triage. Today given one N95 to reuse for the ‘foreseeable future’. Can only wear masks for confirmed #coronavirus patients. This is how healthcare workers get infected. This is how we lose This is how we die,1.2455736378196623e+18,0.0,['coronavirus'],Just spoke to a doctor friend who works in large NYC Hospital doing triage. Today given one N95 to reuse for the foreseeable future. Can only wear masks for confirmed patients. This is how healthcare workers get infected. This is how we lose This is how we die,"['just', 'spoke', 'doctor', 'friend', 'work', 'larg', 'nyc', 'hospit', 'triag', 'today', 'given', 'one', 'n95', 'reus', 'forese', 'futur', 'can', 'wear', 'mask', 'confirm', 'patient', 'thi', 'healthcar', 'worker', 'get', 'infect', 'thi', 'lose', 'thi', 'die']"
511,511,511,511,2020-04-02 04:48:46,3544.0,444.0,en,"Portland, ME",0.0,HinckJon,"The USA is on track to lose 1million+ people to #COVID19, not 100k to 200k like @POTUS reluctantly acknowledged. We should: 1) order mass scale PPE prod. per The DPA; 2) protect &amp; pay health care other, workers; 3) order stay-at-home nationally; 4) require masks for all activity.",1.245573869840126e+18,0.0,['COVID19'],"The USA is on track to lose million+ people to , not k to k like reluctantly acknowledged. We should: ) order mass scale PPE prod. per The DPA; ) protect &amp; pay health care other, workers; ) order stay-at-home nationally; ) require masks for all activity.","['the', 'usa', 'track', 'lose', 'million+', 'peopl', 'k', 'k', 'like', 'reluctantli', 'acknowledg', 'We', ':', 'order', 'mass', 'scale', 'ppe', 'prod', 'per', 'the', 'dpa', 'protect', '&', 'amp', 'pay', 'health', 'care', 'worker', 'order', 'stay-at-hom', 'nation', 'requir', 'mask', 'activ']"
512,512,512,512,2020-04-02 04:49:06,45051.0,532.0,en,"California, USA",1.0,FabioDL,"This. Not wearing masks to protect against coronavirus is a ‘big mistake,’ top Chinese scientist says",1.2455739529292923e+18,0.0,[],"This. Not wearing masks to protect against coronavirus is a big mistake, top Chinese scientist says","['thi', 'not', 'wear', 'mask', 'protect', 'coronaviru', 'big', 'mistak', 'top', 'chines', 'scientist', 'say']"
513,513,513,513,2020-04-02 04:49:37,22251.0,455.0,en,Oakland,2.0,D_A_G_Chaos,"Some evidence shows wearing a face covering may reduce spread of coronavirus, but masks are still no substitute for physical distancing, #California’s top public health official said Wednesday, outlining new official guidance. #Masks4All",1.245574083279868e+18,0.0,"['California', 'Masks4All']","Some evidence shows wearing a face covering may reduce spread of coronavirus, but masks are still no substitute for physical distancing, s top public health official said Wednesday, outlining new official guidance.","['some', 'evid', 'show', 'wear', 'face', 'cover', 'may', 'reduc', 'spread', 'coronaviru', 'mask', 'still', 'substitut', 'physic', 'distanc', 'top', 'public', 'health', 'offici', 'said', 'wednesday', 'outlin', 'new', 'offici', 'guidanc']"
514,514,514,514,2020-04-02 04:51:29,34037.0,33291.0,en,THE OP,80.0,RampageRantz,If I had a hundred extra masks I’d make a video drying my nuts on each one of them before packaging and sending off to #Wuhan 🤣,1.2455745524002202e+18,0.0,['Wuhan'],If I had a hundred extra masks Id make a video drying my nuts on each one of them before packaging and sending off to,"['If', 'hundr', 'extra', 'mask', 'Id', 'make', 'video', 'dri', 'nut', 'one', 'packag', 'send']"
515,515,515,515,2020-04-23 16:34:06,9752.0,76321.0,en,"Portland, Maine",6.0,WGME,"Boxes, not passengers, were buckled into seats on an All Nippon Airways flight from Shanghai, China to Tokyo, Japan on Wednesday. The boxes were filled with masks, protective clothing, and other medical supplies needed to fight the coronavirus pandemic.",1.2533615173004575e+18,1.0,[],"Boxes, not passengers, were buckled into seats on an All Nippon Airways flight from Shanghai, China to Tokyo, Japan on Wednesday. The boxes were filled with masks, protective clothing, and other medical supplies needed to fight the coronavirus pandemic.","['box', 'passeng', 'buckl', 'seat', 'all', 'nippon', 'airway', 'flight', 'shanghai', 'china', 'tokyo', 'japan', 'wednesday', 'the', 'box', 'fill', 'mask', 'protect', 'cloth', 'medic', 'suppli', 'need', 'fight', 'coronaviru', 'pandem']"
516,516,516,516,2020-04-23 16:34:05,71343.0,1170.0,en,"Florida, USA",33.0,TrumpWatchNews,RT @CraigCaplan: House is NOW in legislative session during the coronavirus pandemic. Rep. Castor (D-FL) wearing a mask is presiding. Chapl…,1.253361513559216e+18,0.0,[],: House is NOW in legislative session during the coronavirus pandemic. Rep. Castor (D-FL) wearing a mask is presiding. Chapl,"[':', 'hous', 'now', 'legisl', 'session', 'coronaviru', 'pandem', 'rep.', 'castor', 'd-fl', 'wear', 'mask', 'presid', 'chapl']"
517,517,517,517,2020-04-23 16:34:37,309.0,173.0,en,"Bossier City, LA",0.0,Brewyet14,It may just be the coolest mask I've made so far! @NKOTB @markwahlberg @DonnieWahlberg @WahlbergBrandon @JennyMcCarthy #boyband #facemask #coronavirus,1.2533616459313766e+18,0.0,"['boyband', 'facemask', 'coronavirus']",It may just be the coolest mask I've made so far!,"['It', 'may', 'coolest', 'mask', ""'ve"", 'made', 'far', '!']"
518,518,518,518,2020-04-23 16:36:48,1342.0,205.0,en,"Boston, MA",2.0,bradswing,"Mayor ⁦@marty_walsh⁩, continuing his wonderful leadership of #Boston through #COVID19, shows how to make your own mask AND promote the Greenovate Boston brand!",1.2533621968574587e+18,0.0,"['Boston', 'COVID19']","Mayor , continuing his wonderful leadership of through , shows how to make your own mask AND promote the Greenovate Boston brand!","['mayor', 'continu', 'wonder', 'leadership', 'show', 'make', 'mask', 'and', 'promot', 'greenov', 'boston', 'brand', '!']"
519,519,519,519,2020-04-23 16:36:43,17974.0,2314.0,en,"Springfield, MO",0.0,grovesprof,"Like the mask wearers in the store, I am not yet fully comfortable with my face covered like a surgeon. But I know I need to get there because coronavirus is going to be around a lot longer than just a couple of more weeks.",1.253362175755776e+18,0.0,[],"Like the mask wearers in the store, I am not yet fully comfortable with my face covered like a surgeon. But I know I need to get there because coronavirus is going to be around a lot longer than just a couple of more weeks.","['like', 'mask', 'wearer', 'store', 'yet', 'fulli', 'comfort', 'face', 'cover', 'like', 'surgeon', 'but', 'know', 'need', 'get', 'coronaviru', 'go', 'around', 'lot', 'longer', 'coupl', 'week']"
520,520,520,520,2020-04-23 16:37:03,382.0,72.0,en,"Emmaus, PA",0.0,fifthstreetcx,"Shoutout to @hattie800 for going above and beyond. While her job title is an Occupational Therapist, she's been hand sewing custom masks for her co-workers like a clear lens version for speech pathologists. Give her a CDC approved high-five next time you see her. 🙌 #COVID19",1.2533622584801608e+18,0.0,['COVID19'],"Shoutout to for going above and beyond. While her job title is an Occupational Therapist, she's been hand sewing custom masks for her co-workers like a clear lens version for speech pathologists. Give her a CDC approved high-five next time you see her.","['shoutout', 'go', 'beyond', 'while', 'job', 'titl', 'occup', 'therapist', ""'s"", 'hand', 'sew', 'custom', 'mask', 'co-work', 'like', 'clear', 'len', 'version', 'speech', 'pathologist', 'give', 'cdc', 'approv', 'high-fiv', 'next', 'time', 'see']"
521,521,521,521,2020-04-23 16:37:02,607.0,3139.0,en,USA,2635.0,BOMMPodcast,RT @Kenmeezy: Real love from @MoneyLynch 🙏🏾 handing out masks #COVID19 😷,1.2533622561355653e+18,0.0,['COVID19'],: Real love from handing out masks,"[':', 'real', 'love', 'hand', 'mask']"
522,522,522,522,2020-04-23 16:38:14,7445.0,826.0,en,"Louisiana, USA",9.0,HealthFreedomLA,@LouisianaGov @LADeptHealth @AGJeffLandry @theadvocatebr @shreveporttimes @LouisianaTimes “...both surgical and cotton masks seem to be ineffective in preventing the dissemination of SARS–CoV-2...” #MaskUpLA #ReOpenLA,1.2533625567874417e+18,0.0,"['MaskUpLA', 'ReOpenLA']",...both surgical and cotton masks seem to be ineffective in preventing the dissemination of SARSCoV-2...,"['...', 'surgic', 'cotton', 'mask', 'seem', 'ineffect', 'prevent', 'dissemin', 'sarscov-2', '...']"
523,523,523,523,2020-04-23 16:38:40,0.0,911.0,en,"New York, New York",0.0,TheArticleTrunk,Gay couple fights prejudice and coronavirus in Poland by distributing rainbow face masks,1.2533626677016166e+18,0.0,[],Gay couple fights prejudice and coronavirus in Poland by distributing rainbow face masks,"['gay', 'coupl', 'fight', 'prejudic', 'coronaviru', 'poland', 'distribut', 'rainbow', 'face', 'mask']"
524,524,524,524,2020-04-23 16:39:03,4897.0,9957.0,en,"Houston, Texas, USA",106.0,1CitizenSailor,RT @ScottHendrick49: GOVERNMENT TYRANNY HITS TEXAS: Judge Hildago @LinaHidalgoTX signs 30-day coronavirus mask order blasted as 'ultimate g…,1.253362763608531e+18,0.0,[],: GOVERNMENT TYRANNY HITS TEXAS: Judge Hildago signs -day coronavirus mask order blasted as 'ultimate g,"[':', 'govern', 'tyranni', 'hit', 'texa', ':', 'judg', 'hildago', 'sign', '-day', 'coronaviru', 'mask', 'order', 'blast', ""'ultim"", 'g']"
525,525,525,525,2020-04-23 16:39:39,139.0,773.0,en,"Columbus, OH",0.0,EWI_innovation,"EWI, in partnership with @buildmomentumus of Virginia, responded to the protective medical mask shortage with this new compliant mask prototype – now available to the public and free via open source! #covid19 #coronavirus #medicalmask #manufacturing",1.253362914309931e+18,0.0,"['covid19', 'coronavirus', 'medicalmask', 'manufacturing']","EWI, in partnership with of Virginia, responded to the protective medical mask shortage with this new compliant mask prototype now available to the public and free via open source!","['ewi', 'partnership', 'virginia', 'respond', 'protect', 'medic', 'mask', 'shortag', 'new', 'compliant', 'mask', 'prototyp', 'avail', 'public', 'free', 'via', 'open', 'sourc', '!']"
526,526,526,526,2020-04-23 16:39:41,5493.0,752.0,en,United States,0.0,W56Annie,"@dbongino @RWoodcock89 You go first. Without a mask, without any rules or regulations, without social distancing. Just have a big old Coronavirus Catch It Party. Then let us know how you and all your party goers are in a couple of weeks. I’ll wait.",1.25336292219093e+18,0.0,[],"You go first. Without a mask, without any rules or regulations, without social distancing. Just have a big old Coronavirus Catch It Party. Then let us know how you and all your party goers are in a couple of weeks. Ill wait.","['you', 'go', 'first', 'without', 'mask', 'without', 'rule', 'regul', 'without', 'social', 'distanc', 'just', 'big', 'old', 'coronaviru', 'catch', 'It', 'parti', 'then', 'let', 'us', 'know', 'parti', 'goer', 'coupl', 'week', 'ill', 'wait']"
527,527,527,527,2020-04-23 16:40:34,1833.0,2599.0,en,"Quail Run, Fremont, CA 94555",0.0,dw504966,Tony Ferguson gives prediction for UFC 249 showdown with Justin Gaethje Baby said I look like Tony with my fucking Covid mask ON!,1.2533631451558298e+18,0.0,[],Tony Ferguson gives prediction for UFC showdown with Justin Gaethje Baby said I look like Tony with my fucking Covid mask ON!,"['toni', 'ferguson', 'give', 'predict', 'ufc', 'showdown', 'justin', 'gaethj', 'babi', 'said', 'look', 'like', 'toni', 'fuck', 'covid', 'mask', 'ON', '!']"
528,528,528,528,2020-04-23 16:21:12,19437.0,597.0,en," greenville,south carolina",30.0,meta1711,RT @NYDailyNews: Ten California nurses who were suspended for refusing to care for coronavirus patients without N95 masks are heading back…,1.253358271236395e+18,0.0,[],: Ten California nurses who were suspended for refusing to care for coronavirus patients without N95 masks are heading back,"[':', 'ten', 'california', 'nurs', 'suspend', 'refus', 'care', 'coronaviru', 'patient', 'without', 'n95', 'mask', 'head', 'back']"
529,529,529,529,2020-04-23 16:22:04,59727.0,4161.0,en,California,0.0,HPTarget,"Photos show how shortages are forcing doctors and nurses to improvise coronavirus PPE from snorkel masks, pool noodles, and trash bags #projectmanagement",1.253358488530514e+18,0.0,['projectmanagement'],"Photos show how shortages are forcing doctors and nurses to improvise coronavirus PPE from snorkel masks, pool noodles, and trash bags","['photo', 'show', 'shortag', 'forc', 'doctor', 'nurs', 'improvis', 'coronaviru', 'ppe', 'snorkel', 'mask', 'pool', 'noodl', 'trash', 'bag']"
530,530,530,530,2020-04-23 16:22:45,93186.0,6847.0,en,"Arlington, TX",0.0,Sclark4273,Texas judge’s 30-day coronavirus mask order blasted as 'ultimate government overreach',1.2533586612940636e+18,0.0,[],Texas judges -day coronavirus mask order blasted as 'ultimate government overreach',"['texa', 'judg', '-day', 'coronaviru', 'mask', 'order', 'blast', ""'ultim"", 'govern', 'overreach']"
531,531,531,531,2020-04-23 16:23:43,945.0,160.0,en,"Madison Heights, MI",0.0,HealingHavenABA,"Our multi-talented Founder &amp; Director, Jamie McGillivary, is finding #stressrelief in sewing masks for our team members for when we are able to return to in person therapy. But for now, we continue with #telehealth services. #stayhome #covid19",1.2533589040811827e+18,0.0,"['stressrelief', 'telehealth', 'stayhome', 'covid19']","Our multi-talented Founder &amp; Director, Jamie McGillivary, is finding in sewing masks for our team members for when we are able to return to in person therapy. But for now, we continue with services.","['our', 'multi-tal', 'founder', '&', 'amp', 'director', 'jami', 'mcgillivari', 'find', 'sew', 'mask', 'team', 'member', 'abl', 'return', 'person', 'therapi', 'but', 'continu', 'servic']"
532,532,532,532,2020-04-23 16:25:06,169999.0,11593.0,en,United States,1167.0,tafl56,"RT @WhiteHouse: Thank you for donating 1 million masks to those fighting Coronavirus on the front lines, @BassProShops! 🇺🇸",1.253359252820816e+18,0.0,[],": Thank you for donating million masks to those fighting Coronavirus on the front lines, !","[':', 'thank', 'donat', 'million', 'mask', 'fight', 'coronaviru', 'front', 'line', '!']"
533,533,533,533,2020-04-23 16:26:12,327.0,14.0,en,"Downingtown, PA",0.0,JMordosky,"Southeastern Pa. will ‘be among the last’ to ease coronavirus rules, Wolf says; Philly students will likely have to wear masks whenever they return to school via @phillyinquirer",1.2533595297833697e+18,0.0,[],"Southeastern Pa. will be among the last to ease coronavirus rules, Wolf says; Philly students will likely have to wear masks whenever they return to school via","['southeastern', 'pa.', 'among', 'last', 'eas', 'coronaviru', 'rule', 'wolf', 'say', 'philli', 'student', 'like', 'wear', 'mask', 'whenev', 'return', 'school', 'via']"
534,534,534,534,2020-04-23 16:26:50,2624.0,664.0,en,"Sacramento, CA",1.0,connectist,BREAKING 4/23/2020: New access to these 3M brand 1860 and other masks!!! Only selling to health care providers. Connect with our Minneapolis-based team by phone to meet your needs now. #coronavirus #PPE #PPEshortage #ThursdayMotivation PLEASE RETWEET,1.253359688168571e+18,0.0,"['coronavirus', 'PPE', 'PPEshortage', 'ThursdayMotivation']",BREAKING /23/2020: New access to these M brand and other masks!!! Only selling to health care providers. Connect with our Minneapolis-based team by phone to meet your needs now. PLEASE RETWEET,"['break', '/23/2020', ':', 'new', 'access', 'M', 'brand', 'mask', '!', '!', '!', 'onli', 'sell', 'health', 'care', 'provid', 'connect', 'minneapolis-bas', 'team', 'phone', 'meet', 'need', 'pleas', 'retweet']"
535,535,535,535,2020-04-23 16:28:11,22481.0,227.0,en,"Flavortown, OH",10.0,junnokoneko,"RT @CBSSunday: ""Get on your mask!"" Gloria Estefan rewrites hit song to promote coronavirus safety",1.2533600283518935e+18,0.0,[],": ""Get on your mask!"" Gloria Estefan rewrites hit song to promote coronavirus safety","[':', '``', 'get', 'mask', '!', ""''"", 'gloria', 'estefan', 'rewrit', 'hit', 'song', 'promot', 'coronaviru', 'safeti']"
536,536,536,536,2020-04-23 16:29:51,98856.0,4747.0,en,The United States of America,3.0,DJLOK,"Other than my profile pic, I’m NOT wearing a mask. #coronavirus",1.2533604483862733e+18,0.0,['coronavirus'],"Other than my profile pic, Im NOT wearing a mask.","['other', 'profil', 'pic', 'Im', 'not', 'wear', 'mask']"
537,537,537,537,2020-04-23 16:29:53,12811.0,2940.0,en,"Springfield, IL",0.0,Angel19722,Texas judge’s 30-day coronavirus mask order blasted as 'ultimate government overreach' #FoxNews,1.2533604568587674e+18,0.0,['FoxNews'],Texas judges -day coronavirus mask order blasted as 'ultimate government overreach',"['texa', 'judg', '-day', 'coronaviru', 'mask', 'order', 'blast', ""'ultim"", 'govern', 'overreach']"
538,538,538,538,2020-04-23 16:30:02,0.0,154.0,en,"Columbus, OH",0.0,NewsFromThePugh,BBB scam alert: That face mask could be a con #COVID19 #coronavirus,1.2533604918896394e+18,0.0,"['COVID19', 'coronavirus']",BBB scam alert: That face mask could be a con,"['bbb', 'scam', 'alert', ':', 'that', 'face', 'mask', 'could', 'con']"
539,539,539,539,2020-04-23 16:31:39,194927.0,11624.0,en,"Southeast-GA,SC,NC,VA",10.0,KimBrame,RT @AIIAmericanGirI: Texas judge's 30-day coronavirus mask order blasted as 'ultimate government overreach' @FoxNew…,1.253360900758737e+18,0.0,[],: Texas judge's -day coronavirus mask order blasted as 'ultimate government overreach',"[':', 'texa', 'judg', ""'s"", '-day', 'coronaviru', 'mask', 'order', 'blast', ""'ultim"", 'govern', 'overreach']"
540,540,540,540,2020-04-23 16:32:01,21817.0,2536.0,en,"NJ Dept. of State, Trenton, NJ",2.0,NJ_BAC,"Remember to discard of gloves and masks properly, #NewJersey! #Coronavirus #StaySafe",1.2533609905001267e+18,1.0,"['NewJersey', 'Coronavirus', 'StaySafe']","Remember to discard of gloves and masks properly, !","['rememb', 'discard', 'glove', 'mask', 'properli', '!']"
541,541,541,541,2020-04-23 16:33:09,47786.0,424.0,en,"Cambridge, MA",48.0,susanicox,"RT @WBUR: After Brigham and Women's Hospital in Boston began requiring that nearly everyone in the hospital wear masks, new coronavirus inf…",1.253361279252738e+18,0.0,[],": After Brigham and Women's Hospital in Boston began requiring that nearly everyone in the hospital wear masks, new coronavirus inf","[':', 'after', 'brigham', 'women', ""'s"", 'hospit', 'boston', 'began', 'requir', 'nearli', 'everyon', 'hospit', 'wear', 'mask', 'new', 'coronaviru', 'inf']"
542,542,542,542,2020-04-23 19:10:55,103268.0,869.0,en,Southampton ,86.0,j00liju,"RT @Betelgeuse100: If you wear a mask for protection against #COVID19, PLEASE make sure it not only protects you, but also highlights the p…",1.253400981934682e+18,0.0,['COVID19'],": If you wear a mask for protection against , PLEASE make sure it not only protects you, but also highlights the p","[':', 'If', 'wear', 'mask', 'protect', 'pleas', 'make', 'sure', 'protect', 'also', 'highlight', 'p']"
543,543,543,543,2020-04-23 19:11:00,44990.0,1966.0,en,"Northampton, MA",1.0,Susanne_Dunlap,"Somehow promoting myself heavily right now feels wrong. So many more important things going on. I've sewn some masks, I'm very busy with editing and coaching work, and I'm actually writing a lot. But self-promotion feels particularly hollow right now. #writingcommunity #covid19",1.253401002864083e+18,0.0,"['writingcommunity', 'covid19']","Somehow promoting myself heavily right now feels wrong. So many more important things going on. I've sewn some masks, I'm very busy with editing and coaching work, and I'm actually writing a lot. But self-promotion feels particularly hollow right now.","['somehow', 'promot', 'heavili', 'right', 'feel', 'wrong', 'So', 'mani', 'import', 'thing', 'go', ""'ve"", 'sewn', 'mask', ""'m"", 'busi', 'edit', 'coach', 'work', ""'m"", 'actual', 'write', 'lot', 'but', 'self-promot', 'feel', 'particularli', 'hollow', 'right']"
544,544,544,544,2020-04-23 19:11:54,202599.0,7047.0,en,"Metairie, LA",154.0,blingarama,"RT @CHIZMAGA: If a fart can pass through your jeans, how is a mask gonna save you from catching Coronavirus? 😂",1.253401229515985e+18,0.0,[],": If a fart can pass through your jeans, how is a mask gonna save you from catching Coronavirus?","[':', 'If', 'fart', 'pass', 'jean', 'mask', 'gon', 'na', 'save', 'catch', 'coronaviru']"
